date,tweet2019-05-03 08:25:03+00:00,British Motor Oil @YouLikeCarsUK @AutomotiveAsset @CarKeys_UK @screamingcars @Gandalfwasme @AVC_Leasing @JA_Autos @AdmarkUK @zdravkost @rafredarrows @realDonaldTrump @RunnerService @bgmotogp @FormulaOneWorld @CrienaLDavies @Imperialcar @my_hpi @tesla @bmw http://www.ultimogt.com pic.twitter.com/Rv9Kh7uiAd
2019-05-03 08:22:32+00:00,"Tesla is the Greatest of All Time with a Fitting Horn Due, Boasts Elon Musk https://www.ccn.com/elon-musk-tesla-g-o-a-t-car-horn-to-match …"
2019-05-03 08:18:39+00:00,"This is amazing, simply amazing. At zero additional cost, hundreds of thousands of cars r now safer with an OTA. We start to take it for granted what Tesla does but step back and think or imagine if Mercedes or Toyota would be able to do a tiny bit of it. $tslahttps://twitter.com/Tesla/status/1124120212628856833 …"
2019-05-03 08:07:41+00:00,"#Tesla Model 3 registrations unable to sustain high deliveries in Norwegian electric car halo market. Down 86.5% on previous month April deliveries 720 units, with the e-Golf knocking it from the top spot in the month of April. OFV/own research pic.twitter.com/PtItH6pHrJ"
2019-05-03 07:53:23+00:00,"Dear CNN: No, Tesla Autopilot does NOT offer “some self-driving functions”. It’s driver assistance. Signed, A Tesla owner https://www.cnn.com/2019/05/02/tech/telsa-autopilot-crash-suit/index.html …"
2019-05-03 07:45:04+00:00,Family Of Man Killed In Tesla Crash Sues Musk For Treating Drivers Like Lab Rats http://ow.ly/MvU930oCrUH
2019-05-03 07:44:25+00:00,All due respect Pomp but... Aside from Tesla @elonmusk is in the Rocket business $XRP https://twitter.com/APompliano/status/1124133462326247425 …
2019-05-03 07:35:49+00:00,I don't read news. I look at fundamentals. Tesla cars will dominate the market in 5-7 years. They're way ahead of competition. IMO.
2019-05-03 07:34:00+00:00,"1) I believe $tsla will stop selling cars to the public, at least some production quarters. This is based on the below quote. When Tesla will get its first city approval for FSD, let’s say in Shanghai, then that city alone can take 1 million FSD cars. pic.twitter.com/pQ7rGio38O"
2019-05-03 07:30:07+00:00,Tesla releases new Emergency Lane Departure Avoidance feature that will automatically steer owners out of harms way and back into lane in emergency situations. https://www.teslarati.com/tesla-autopilot-lane-departure-avoidance-safety/ …
2019-05-03 07:29:00+00:00,"Crazy rain on my 50 km commute just now. Highway was reflective, low visibility, very difficult to see lane lines. #AutoPilot was bouncing around quite a bit, seemed unsure, so I took over. After about two minutes I realized it was doing a much better job than I was. @Tesla"
2019-05-03 07:27:44+00:00,"Only 1 Stall available at Baoding, Hebei Province, China All of the rest occupied by Non-Tesla Vehicles. This is a big problem in 2nd and 3rd Tier Cities in China. @Tesla China please deploy floor lock solutions at these locations. #Tesla #TeslaChina #Supercharger #特斯拉pic.twitter.com/bGeECunJl3"
2019-05-03 07:20:26+00:00,2019 Most desirable companies to work for in China per @LinkedIn: 1. Alibaba 2. Baidu 3. Bytedance 4. Fosun 5. Nio 6. Tesla 7. DiDi 8. Amazon 9. Huawei 10. Meituan 11. Ant 12. Netease 13. JD 14. L’Oreal 15. Apple 16. Kuaishou 17. Oracle https://www.linkedin.com/pulse/2019-%E5%B9%B4%E9%A2%86%E8%8B%B1%E9%A1%B6%E5%B0%96%E5%85%AC%E5%8F%B8%E6%8E%92%E8%A1%8C%E6%A6%9C%E4%B8%AD%E5%9B%BD%E8%81%8C%E5%9C%BA%E4%BA%BA%E6%9C%80%E5%90%91%E5%BE%80%E7%9A%84%E4%BC%81%E4%B8%9A-nolan-chen-yi …
2019-05-03 07:19:44+00:00,"$TSLAQ SAN FRANCISCO (Reuters) - ""Tesla Inc Chief Executive Elon Musk personally owes $507 million to Wall Street banks involved in Tesla's stock and debt sale, backed by his stake in the electric car maker, a company filing showed on Thursday."" https://www.yahoo.com/finance/news/elon-musk-owes-507-million-banks-helping-tesla-002550915--sector.html …"
2019-05-03 07:18:30+00:00,"Nikola Tesla is a revolutionary scientist who also had a curiosity for the supernatural. It is no surprise then, that some of his inventions are still used by paranormal investigators to this day. https://www.livinglifeinfullspectrum.com.au/blog/teslas-supernatural-inventions/ …"
2019-05-03 06:50:25+00:00,Hot of the press:April’19 car registrations: 538 registered Teslas! Compared to April’18 (67) +703% more this year!! Compared to March’19 -56% (Backlog?) @Tesla sold +384% compared to April’18(YTD) Trend is strong! @elonmusk @TeslaSchweiz @InsideEVs @ElectriveNet @ElectrekCopic.twitter.com/tjgbLaIcJH
2019-05-03 06:44:25+00:00,"As Tesla will soon release its own car insuranceproducts, great overview of how it might revamp #UX leveraging #data its cars have been generating / collecting for years. #InsurTech #FinTech https://www.linkedin.com/pulse/tesla-insurance-elon-musk-backseat-insurer-martha-notaras …pic.twitter.com/ikIzdAXQJu"
2019-05-03 06:39:19+00:00,Elon Musk personally owes $507 million to banks helping Tesla raise capital https://reut.rs/2GQllaC by @randewichpic.twitter.com/u4nFQ4PDn7
2019-05-03 06:27:24+00:00,Jalopnik has not always been good to Tesla or EVs but kudos where it's due... https://jalopnik.com/enough-with-the-actually-electric-cars-pollute-more-bu-1834338565 …
2019-05-03 06:22:07+00:00,This the neega That be scamming y’all with the drop shipping BS and how he bought his own house and a Tesla LMFAOOOOOOOOOOOOOOOOOOOOOOOOOOOOOOOOOOOOOOOOOOOOOOOOOOOOOOOOOOOOOOOOOOOOOOO pic.twitter.com/d8kaHVxFQd
2019-05-03 05:52:26+00:00,Tesla Rolls Out New Features That Improve Safety Without Autopilot https://cleantechnica.com/2019/05/03/tesla-rolls-out-new-features-that-improve-safety-without-autopilot/ …pic.twitter.com/3EntXemwHF
2019-05-03 05:40:23+00:00,"Looks like the @Tesla FSD option price hike happened after all. @elonmusk isn’t kidding when he says the price will go up substantially over time. Buy it now, if you can - it’s a bargain. This might ultimately cost $100K+. $TSLApic.twitter.com/z7CxBw56Wt"
2019-05-03 05:30:47+00:00,"Have had chats with billionaires/UHNW people about @Tesla, who have large long positions. The conspiratorial shorts (+analysts) are disconnected from Tesla’s monumental wins + momentum + @elonmusk’s reputation as an innovator. Deep pockets will back him for a very. long. time."
2019-05-03 05:25:21+00:00,TSLAQ is basing all of their assumption on guesstimates & they lie. Here is just the latest proof. Remember Tesla death watch? They have been calling margin calls for years. Hint: it never happened. Just like Tesla killers never happened. pic.twitter.com/XQPQx0FIwZ
2019-05-03 05:15:03+00:00,"Heard on the Street: Elon Musk and Tesla have finally decided to raise money, but shareholders shouldn’t expect more than a temporary reprieve https://on.wsj.com/2ZKuOc6"
2019-05-03 05:12:46+00:00,Exclusive: @Tesla expects global shortage of #ElectricVehicle #battery minerals - sources | Article [AMP] | ⁦ @Reuters⁩ #Lithium #BatteryMetals $TSLA $RCK.Vhttps://www.reuters.com/article/us-usa-lithium-electric-tesla-exclusive-idUSKCN1S81QS …
2019-05-03 05:00:20+00:00,Who’s ready for the @SpaceX launch tonight at 3:11am ET? (Hopfully the weather holds up *Fingers crossed*) . . . #SpaceX #Falcon9 #FalconHeavy #SpaceDay #ISS #InternationalSpaceStation #spacecadetwannabe #TessaMcEvoy #Mars #ElonMusk #Tesla pic.twitter.com/YQ38drH2P2
2019-05-03 04:55:31+00:00,Elon Musk owes $507 million to banks helping Tesla raise capital http://www.reuters.com/article/us-tesla-offering-banks-idUSKCN1S901E?utm_campaign=trueAnthem%3A+Trending+Content&utm_content=5ccbc9bddf42390001116f6d&utm_medium=trueAnthem&utm_source=twitter …pic.twitter.com/sO21cVM33B
2019-05-03 04:46:48+00:00,"He wanted safe payment method, created #Paypal. He wanted to drive electric car, created #Tesla. He wanted to go to space, created #SpaceX. He wanted faster transportation, created #Hyperloop. #ElonMusk doesn't complain how bad the world is, he is changing the world for good."
2019-05-03 04:40:41+00:00,Tesla adds Lane Departure Avoidance that works when Autopilot is off http://bit.ly/2ZRUzYg
2019-05-03 04:28:05+00:00,"Here we go: @Tesla warns of upcoming shortages of battery minerals! Keep in mind: Tesla + @VW are the carmakers with the most mining industry understanding, and both start to secure #lithium longterm. What happens when the others wake up? #Battery #EV $RCKhttps://electrek.co/2019/05/02/tesla-shortage-battery-minerals-nickle-copper-lithium/ …"
2019-05-03 04:27:53+00:00,Tesla longs: We’re the world’s most unbearable cult! Berkshire meeting attendees: Hold our beer!
2019-05-03 04:25:29+00:00,Tesla seen finding ample appetite for its newest convertible bond http://www.reuters.com/article/us-tesla-offering-bonds-idUSKCN1S82FH?utm_campaign=trueAnthem%3A+Trending+Content&utm_content=5ccbc2b2e506e700010724f3&utm_medium=trueAnthem&utm_source=twitter …pic.twitter.com/gsiRnCqABx
2019-05-03 04:20:46+00:00,"Tesla has a fully instrumented catalog of car crashes, orders of magnitude larger than any organization on Earth or in history. And every day it adds to that catalog. In two months it will add more car crashes to its dataset than Waymo has seen in its history."
2019-05-03 04:15:27+00:00,"It’s also a dataset unavailable to any other market participant. The idea that most of Tesla’s data is “boring” is both obvious and misses the point. Every day single day Bowers sees a new, completely novel, accident. He sees the sensor data, the driver data, the vehicle data."
2019-05-03 04:03:03+00:00,This mans are smoke dug loss focus. Tesla car are explosion immolate https://twitter.com/LoliPicturesBot/status/1122147854766813185 …
2019-05-03 03:45:48+00:00,"If you wanted to get really wonky, Dana, you could go down this rabbit hole... It looks like Tesla has no WKSI waiver, and from where I'm sitting it looks like they pretty clearly are no longer eligible. Maybe you can get a comment to clear it up. pic.twitter.com/5fxxb27g8b"
2019-05-03 03:45:04+00:00,Here's what Tesla's multibillion-dollar factory in China looks like so far pic.twitter.com/vvEu6ZZsqc
2019-05-03 03:32:29+00:00,Never gets old. Thanks @Tesla! pic.twitter.com/2tYvVcs5Pj
2019-05-03 02:55:13+00:00,Tesla Semi truck spotted on one of Los Angeles' busiest freeways with trailer and massive concrete blocks in tow https://www.teslarati.com/tesla-semi-prototype-maximum-weight-range-test/ …
2019-05-03 02:39:07+00:00,Got our @Tesla referral program toy car and decided to donate it to the perfect charity; @VarietyAlberta They match toy electric cars to children with disabilities to help them with mobility. Check out the program here; http://varietyalberta.ca/go-baby-go/ #tesla #evpic.twitter.com/Rc815r9WaK
2019-05-03 02:35:50+00:00,"Extraordinary claims require extraordinary evidence. Unless the driver’s seat was empty and Ross Gerber selected a random pickup and drop location, there is no evidence he took a ride in a “Full Self Driving” Tesla. https://twitter.com/GerberKawasaki/status/1123998802199887872 …"
2019-05-03 02:35:14+00:00,"Its cash reserves dwindling, Tesla has announced a plan to raise $2 billion through the sale of additional shares of stock and debt https://cnn.it/2GYJuMq pic.twitter.com/kL43fNZ1Xk"
2019-05-04 23:42:53+00:00,Saw one Tesla in NOLA in 3 days. Saw 15 teslas on the way home from the airport. The revolution is coming... #EV #Tesla $tsla
2019-05-04 23:23:30+00:00,"Juicy came home! I couldn't be happier to have her back! Thanks @EuroMtrCarWorks! This #Tesla #ModelS front end body repair took 5 months and 1 week, over half of the time spent waiting for parts. @elonmusk @tesla #wherearetheparts #teslaserviceissues ...... Twitter Radio Silencepic.twitter.com/JN3hFRu1PJ"
2019-05-04 23:19:54+00:00,OMFG... Tesla buys calls to force banks to buy stock to balance hedge funds shorting stock to pair with the convertible???
2019-05-04 23:10:27+00:00,"Whenever a short seller calls Elon Musk a fraud, just reply with this GIF (not a shareholder of Tesla/SpaceX, just a fan) pic.twitter.com/3ArECgzZvV"
2019-05-04 23:09:21+00:00,To all the muppets liking and sharing this tweet: - I've probably done more homework than you and my take on Tesla hasn't changed a bit: this company is heading to zero. - My puts may have dropped in price but they haven't lost their value. Unlike your Teslas. https://twitter.com/robinivski/status/1124349050780823553 …
2019-05-04 23:08:40+00:00,"That's right. I'm getting a Tesla Model 3. Long range dual wheel drive. White exterior and interior. Regular 18"" Aero Wheels. Full self-driving. And. I. Cannot. Wait."
2019-05-04 23:08:20+00:00,Many claim that more EV competition would be terrible for @Tesla. It's actually the complete opposite. Tesla always had an incredible amount of competition: ~90M gas guzzlers sold annually. Better understanding of EVs would be a massive tailwind for Tesla.
2019-05-04 23:05:56+00:00,"So.... I've got something exciting coming in a few weeks and if you want one too use my referral code and to get 5,000 free Supercharger miles: https://ts.la/kent64865 #Tesla #Model3"
2019-05-04 23:03:04+00:00,$tslaq $tsla #Tesla @evacuationboy #SGF SGF T-Shirt In today’s mail!!!pic.twitter.com/lJIdFcQrpw
2019-05-04 23:01:02+00:00,Tesla Model 3 Cheaper Than Honda Accord — 15 Cost Comparisons [Updated] https://cleantechnica.com/2019/05/04/tesla-model-3-cheaper-than-honda-accord-15-cost-comparisons-updated/ …pic.twitter.com/39wLMbLxUg
2019-05-04 22:37:35+00:00,"I recently started an organization for social science students to receive guidance after undergrad, bought a Tesla cash, my tv show just got approved for Oprah Winfrey’s network."
2019-05-04 22:33:57+00:00,"Huge fan of @Tesla & @elonmusk. Love my car. But concerned re: service. Tried to get help for 3 days for a critical issue that intermittently renders my car useless, including being stranded for ~3 hrs today. Best i could get was Appt 5 days after issue started."
2019-05-04 22:24:44+00:00,i’m not over him driving this sexy tesla pic.twitter.com/3g2W3cUQmn
2019-05-04 22:20:17+00:00,Two friends chat and one boasts about his new car. “So I’ve got a new Tesla Model X; it drives itself.” “Nice...where is it?” “No idea!”
2019-05-04 22:08:35+00:00,Celebrated Luna turning 1 year old today w a gorgeous road trip from Atlanta (celebrating w @LikeTeslaKim)! 620mi road trips are now no big deal for me thanks to Autopilot I love “pure human driving” sometimes for fun but on long road trips AP saves me #Tesla #model3 @elonmuskpic.twitter.com/tHDbZq512e
2019-05-04 22:02:02+00:00,"“It is difficult to get a man to understand something, when his salary depends on his not understanding it.”pic.twitter.com/FtJ6FCfEof"
2019-05-04 22:01:15+00:00,"Isn't it obvious? Look at motive. In a world of automated cars insurance companies like Warren's Geico stand a lot to lose. Until then, having @Tesla get into the insurance biz is a direct threat to Geico/Buffet's bottom line. . Upton Sinclair said it best..."
2019-05-04 21:46:08+00:00,"THIS DAY IN $TSLAQ HISTORY: Hey Tesla owners, what's the max character length when naming your car? If I ever get a Model 3, I will definitely name it ""Cash-burning DISASTER"" if it's not too long. pic.twitter.com/FBVLYsiNaK"
2019-05-04 21:07:28+00:00,"Tesla could go even higher than our $4,000 price target, says fund manager (via @ETFEdgeCNBC)https://cnb.cx/2Vh6RL2"
2019-05-04 20:59:17+00:00,Buffett knocks Elon Musk’s plan for Tesla to sell insurance: ‘It’s not an easy business’ https://cnb.cx/2GQKphy
2019-05-04 23:40:36+00:00,Has anyone found a technique for getting their #Tesla to recognize a red light in #Autopilot? I have still never seen it...
2019-05-04 23:35:04+00:00,"It took me 3 minutes to read. I live in Cal and the gas price is favorable to the Accord by a lot and so is electricity to the Tesla. Run your own numbers. This is cost per year, not upfront. Come on that one is basic to figure out. pic.twitter.com/uwPwf9fbdd"
2019-05-04 23:16:43+00:00,"People don't appreciate the sophistication of @tesla software development/devops process (and tight HW-SW integration), and the extreme difficulty legacy OEMs will have in replicating regular OTA updates!"
2019-05-04 23:11:30+00:00,I’m guessing he can figure out the insurance business LOL. Especially considering the amount of data Tesla has about their cars. pic.twitter.com/Wj9QxwpsRN
2019-05-04 23:08:42+00:00,y’all she just straight embarrassing. if I gotta dress & act like this to get a tesla then I don’t want it pic.twitter.com/vnGc2iF7RJ
2019-05-04 23:06:57+00:00,Buying my Tesla right from my home pic.twitter.com/qo5X93MjA0
2019-05-04 23:06:32+00:00,"The Lamborghini Aventador catches up to a Tesla Model X (The 7 seater) P100D after ~115 MPH. That’s miles of flat runway. For $279,000 less. The Model S is even cheaper, faster and handles better than an Aventador. With that in mind, getting a Lambo looks silly."
2019-05-04 22:57:22+00:00,"This article’s headline says @Tesla’s RoboTaxi plan lacked details, but then the article is full of details, complains that ⁦ @elonmusk⁩’s plan “lacked important details like how the company would handle INSURANCE for its robo-taxi fleet.” LOLhttp://www.businessinsider.com/tesla-takes-direct-aim-uber-lyft-with-robotaxi-plan-2019-4 …"
2019-05-04 22:45:09+00:00,"Gah! I realized the other day I have a character named Tesla. Who was named before the car was a thing. Dammit! Well, I'm not changing her name. Anything like that ever happen to you?"
2019-05-04 22:44:55+00:00,"I can’t just start playing music when I need to reboot my Tesla every time I want to drive it and have the rear camera work. When will this be fixed? On 12.1.2 now, still broken. This has been going on for over a year now. pic.twitter.com/mdeK00xdsR"
2019-05-04 22:44:37+00:00,"Heads up; whatever Musk is touting, the opposite is true. Two examples in one tweet from jessica; severely dumps prices of hi end devaluing cares and touts ‘appreciating asset’. Touts improvement/investment in service and even apologizes while cutting service centers and support"
2019-05-04 22:34:06+00:00,Not to mention the recently unlocked extra horsepower Tesla buyers bought without realizing it.
2019-05-04 22:31:19+00:00,"The reason why we bought a Tesla is simple! If you want to change the world and survive, you need to act because reaction is not good enough! Look at NOKIA N ot O nly K now I t, but A ct !!! @elonmusk @Tesla @teslaownersaupic.twitter.com/9d3UsutaXu"
2019-05-04 22:28:36+00:00,"for 7 years I've been organizing a drive through the alps (think poor man's gumball 3000) without any restriction on type of car, which has increasingly led to awesome variety. this year we reach a new level, with a participant bringing a TESLA MODEL 3 more"
2019-05-04 22:28:01+00:00,"Abundant, reliable energy is key to pull people out of poverty. People in poverty will take the cheapest energy available, even if it is dirty. It's up to the developed peoples of Earth to help make energy tech cheap AND clean. Tesla understood this. #energy #poverty #nikolateslapic.twitter.com/RF50UYLNEN"
2019-05-04 22:24:08+00:00,"Check out this Tesla Supercharger at a Pilot Gas Station near Tucson, AZ pic.twitter.com/53EQ5lh80b"
2019-05-04 22:22:56+00:00,These gas prices make me want a Tesla
2019-05-04 22:16:01+00:00,Tesla sent employees the most passive-aggressive confidentiality email https://mashable.com/article/tesla-leak-email/ …
2019-05-04 22:13:54+00:00,"Because so many ""normals"" don't know a $35k/$399 lease for a Tesla is an option. For so many all Teslas are $100k cars."
2019-05-04 21:47:53+00:00,"5/ Tesla cautioned: ""In January an employee was identified for sharing confidential business information on Twitter, including production numbers, with journalists. The employee was terminated"" Probably the person in this story who had hurt her hand. https://www.revealnews.org/article/how-tesla-and-its-doctor-made-sure-injured-employees-didnt-get-workers-comp/ …"
2019-05-04 21:47:51+00:00,"1/ People have been asking me, since this story dropped, who do I think Tesla was referencing in their loose lips sink ships email. Here are some reported incidents that seem to fit the description, but if you know otherwise please drop me a line. https://www.cnbc.com/2019/05/03/tesla-email-warns-employees-stop-leaking.html …"
2019-05-04 21:44:13+00:00,"Haven't been to a @Tesla #supercharger in a while, but I stopped by one today. Even after the recent OTA update, looks like my screen still has a glitch when I start to charge. #TeslaQualityIssues $TSLApic.twitter.com/80VsLYVgoZ"
2019-05-04 21:28:21+00:00,Got my first ride in a Model 3! Incredible! #tesla @gwestrpic.twitter.com/jBrPXhjoG2
2019-05-04 21:25:49+00:00,https://www.linkedin.com/pulse/most-people-hard-imagine-hans-noordsij/ … For my Dutch audience I wrote an article about @Tesla #robotaxi and #FSD. It went kind of viral in dutch community (maybe because it gives positive perspective which is not common nowadays) leading to a request for an internationale version. Here it is.
2019-05-04 21:25:13+00:00,The latest video shows the red #Tesla Semi #Truck carrying massive blocks of concrete for testing range and weight ability! #TeslaSemi #SemiTrucks #Trucking #EVs #TruckingLife #Truckshttps://www.xautoworld.com/tesla/semi-truck-weight-testing/ …
2019-05-04 20:48:48+00:00,Buffett on Tesla's plan to sell insurance: 'I'd bet against any company in the auto business' $TSLA $TSLAQhttps://cnb.cx/2VihoFR
2019-05-04 20:42:09+00:00,#Tesla sales in April accounted for 78% of all EVs sold in the United States https://insideevs.com/news/347858/april-2019-78-electric-car-sales-us-teslas/ …pic.twitter.com/K812BeurrU
2019-05-04 20:19:14+00:00,I always wanted a Tesla since I was 12 and now I finally got one! pic.twitter.com/8yDfDD86YX
2019-05-04 20:15:01+00:00,"BUFFETT, ON ELON MUSK'S SUGGESTION THAT TESLA <TSLA.O> MIGHT GET INTO INSURANCE, SAYS AUTOMAKERS GETTING INTO INSURANCE WOULD BE AS SUCCESSFUL AS INSURERS GETTING INTO AUTO INDUSTRY"
2019-05-04 20:14:47+00:00,Keep them coming #tesla!!Vancouver Tesla drivers get 22 new downtown supercharging stations https://www.cbc.ca/news/canada/british-columbia/tesla-supercharging-stations-vancouver-1.5123062 …
2019-05-04 20:13:53+00:00,Elon Musk told investors that self-driving will make Tesla a $500 billion company. https://cnb.cx/2GXabAN
2019-05-04 20:11:11+00:00,"***ENDGAME SPOILERS*** We know @elonmusk is in the MCU because Tony drives a Roadster in Iron Man 1. He also has a cameo in Iron Man 2. So if Tesla exists, why did Audi's EV succeed? Obviously Elon was snapped by Thanos. Since the Snap was undone, obviously Elon is new Iron Man"
2019-05-04 20:08:13+00:00,kia is the tesla of the people
2019-05-04 20:02:15+00:00,Tesla warns employees against leaking info http://bit.ly/2Wmz4MQ
2019-05-04 19:50:36+00:00,"(13/*) I'd like to appeal to @elonmusk and @Tesla to do an update so that after a crash, after the car comes to a stop, after a short period maybe it should release the rest of the doors and trunk automatically. Could probably save some lives, and could have saved this puppy."
2019-05-04 19:39:52+00:00,"Thank you, Tesla & Elon. *Spoilers alert* Now that Ironman died in Avengers:Endgame, I think it is time for us to move on and consider you as the normal human that you are... OR NOT!! pic.twitter.com/xlPwArr6Kl"
2019-05-04 19:33:36+00:00,U.S. rejects Tesla bid for tariff exemption for Autopilot 'brain' https://reut.rs/2H1i3Tm
2019-05-04 19:05:56+00:00,"Electric cars, solar & wind power does not happen without #mining raw materials. #Tesla expects global shortage of #EV battery minerals.https://reut.rs/2WnuvBZ"
2019-05-04 19:00:41+00:00,Tesla Issues Veiled Threat to Staff: Keep Quiet or Face Elon Musk’s Wrath https://www.ccn.com/tesla-issues-veiled-threat-to-staff-keep-quiet-or-face-elon-musks-wrath …
2019-05-04 18:59:24+00:00,"One of the best parts of being a @Tesla veteran is watching the new Model 3 owners joining the EV revolution/family. Tesla have evolved quite a bit since I became an owner and whilst I still see some growing pains, I now cannot see the company ever failing. $tsla $tslaq"
2019-05-04 18:49:05+00:00,Tesla Accounted For 78% Of All-Electric Car Sales In U.S. In April https://insideevs.com/news/347858/april-2019-78-electric-car-sales-us-teslas/amp/ … via @insideevs.com
2019-05-04 18:33:30+00:00,anyway good morning to harry's tesla only. eco-friendly god. he's mother nature's son and will singlehandedly save the planet himself. fuck conservatives. we love our green king
2019-05-04 18:25:27+00:00,"Instead of waiting for Tesla to send me the spoiler, I got one from @lap_tes guys. Very good fit, highly recommended.pic.twitter.com/QpmtffUBSm"
2019-05-04 18:20:00+00:00,Elon Musk heads to Wall Street seeking up to $2.3 billion in new capital for Tesla. More in this week's tech playlist https://reut.tv/2B5rCfA via @ReutersTVpic.twitter.com/x5QgTSlLzl
2019-05-04 18:14:42+00:00,"This is because @tesla is essentially functioning as a proxy war for the climate change debate. The bear troll army is relentless because it isn’t a good faith debate, the goal is to muddy the water & slow down the transition. There is trillions in assets & jobs at stake. $TSLAhttps://twitter.com/lorakolodny/status/1124500258518552576 …"
2019-05-04 18:06:58+00:00,Elon Musk is grimacing all the way to the bank as Tesla finally raises more money http://www.businessinsider.com/why-elon-musk-is-likely-unhappy-tesla-needs-to-raise-more-money-2019-5 …
