date,tweet
2019-05-01 23:53:10+00:00,how you got road rage in a tesla? ain’t u eco friendly?
2019-05-01 23:46:07+00:00,“Tesla does not need to raise cash by issuing new equity in 2019. Anyone who does not get this point does not know how to read a 10K/W.” pic.twitter.com/NfX4m3Ft5r
2019-05-01 23:38:43+00:00,"Old school Roadsters had keys - I’ve repurposed most of my key rings, this one tells everyone in a meeting that the USB is MINE. #Tesla pic.twitter.com/DDO1wWK3C7"
2019-05-01 23:38:09+00:00,"Cadillac SuperCruise is often called the best driver assist solution... by people who either A) don’t own a Tesla, B) don’t know it’s CT6-only, or C) haven’t seen a coverage map (places where you can actually use SuperCruise). I pulled an example just now off Cadillac’s site. pic.twitter.com/Ihqql7sryi"
2019-05-01 23:10:56+00:00,"We won!! @cnbc releases the clip they tried hard to bury, after twitter f*ckstorm of outrage over their clear bias against @tesla https://twitter.com/CNBC/status/1123631945110433794 …"
2019-05-01 23:08:02+00:00,"Just discovered that @tesla Model 3 UK sticker price includes the Plug In Car Grant. Super misleading, and effectively adds £3,500 (10%) to the sticker price. Which tips it beyond my budget and means I’ll cancel my order. After 3 years in the queue that’s heartbreaking"
2019-05-01 23:01:02+00:00,Tesla Shanghai Gigafactory — Structure Nearing Completion (Flyover Video) https://cleantechnica.com/2019/05/01/tesla-shanghai-gigafactory-structure-nearing-completion-flyover-video/ …pic.twitter.com/xtwEPIZpOi
2019-05-01 22:54:35+00:00,"If you’re hunting for yield, there’s always .. Tesla bonds? (via @bopinion) $TSLA https://www.bloomberg.com/news/articles/2019-05-01/-math-doesn-t-lie-musk-can-t-dodge-tesla-cash-woes-any-longer …pic.twitter.com/4tWiKeJLvf"
2019-05-01 22:47:22+00:00,This @Tesla visualization does not instill confidence. pic.twitter.com/rM4VEWgKtj
2019-05-01 22:45:20+00:00,"Why CIO of Major Investment Firm Says Tesla’s Stock is Going to $4,000 https://www.ccn.com/cio-investment-firm-tesla-stock-4000 …"
2019-05-01 22:33:52+00:00,"Everyone keeps talking about all the Tesla competition, but there doesn’t really seem to be a single competitor on the market that I can switch to from my Model 3 without making huge sacrifices on specs"
2019-05-01 22:30:00+00:00,. @elonmusk and @Tesla just demonstrated their fully autonomous driving pic.twitter.com/0GqKT1KTph
2019-05-01 22:29:11+00:00,Have gotten lots of questions on *why* Tesla built its own AI chip and the right way to compare vs. Nvidia's Xavier/Pegasus. Here's a short blog that explains it all in plain English. https://ark-invest.com/research/tesla-fsd …
2019-05-01 22:28:19+00:00,BRENDON URIE COULD RUN ME OVER WITH HIS TESLA AND I WOULD THANK HIM #BBMAspic.twitter.com/u2PCUMqBPE
2019-05-01 22:22:52+00:00,"Tesla autopilot malfunction caused crash that killed Apple engineer, lawsuit alleges http://gizmo.do/IyIy6X2 pic.twitter.com/xh5R4b2zzl"
2019-05-01 22:09:57+00:00,"On your odometer, look at your total energy used divided by the number of days you’ve had your car to figure out how much solar you need to be 100% carbon neural. For me it’s a an average of 21 kWh / day. About 5 hours of max power on a 4 kw Tesla solar system. 2.5 hours on 8kw pic.twitter.com/e2J531WnkX"
2019-05-01 22:04:04+00:00,"""Massive incentives to go green"" means green taxes on the poor to fund subsidies for the middle class. Companies like Tesla don't make money selling vehicles. They make money on the subsidies. #Newsnight"
2019-05-01 22:02:38+00:00,"Great experience with #Tesla mobile service. My mobile tech was knowledgeable, efficient, careful, and explained what he was doing. It turns out my #Model3 didn’t need a new side mirror, rather it just needed a few things tightened inside the door! pic.twitter.com/opgMGpQLZA"
2019-05-01 21:48:49+00:00,Tesla’s infotainment dashboard screen tops Consumer Reports ratings https://www.marketwatch.com/story/teslas-infotainment-dashboard-screen-tops-consumer-reports-ratings-2019-05-01 …
2019-05-01 21:39:47+00:00,"Also it's spelled TESLA, you dummy. Ugh."
2019-05-01 23:59:59+00:00,"/1 So, perhaps to follow up on prior words of @elonmusk that they would be closing stores (until about face) but allow $TSLA purchases anywhere in the US, Tesla, Inc only recently registered itself in last month(!) in AL (3/29), MS (4/23), ND (4/26), ID( 4/2), MT(4/12), NH (4/12) pic.twitter.com/futCtwd1ib"
2019-05-01 23:46:00+00:00,"Tesla opens Model 3 RHD orders in UK, deliveries set for June https://www.teslarati.com/tesla-opens-model-3-rhd-orders-in-uk-deliveries-set-for-june/ …"
2019-05-01 23:34:26+00:00,"Tesla’s reported sales do not jive w/ vehicles registered. True test of sales numbers in the USA, in my opinion, is to use a trusted source like IHS Markit registration data & subtract cum vehicles registered at 12/31/18 from 3/31/19. IHS publishes about mid month. Stay tuned. https://twitter.com/russ1mitchell/status/1123656577360097280 …"
2019-05-01 23:24:12+00:00,"So I've had a #model3 reservation for over 3 years, and I can't be more excited about it finally arriving in the UK. However it looks like there is zero advantage in reserving in the UK, what do we get for the 3 years of £1k deposit, loyalty and patience @elonmusk @Tesla ?"
2019-05-01 23:24:06+00:00,Congrats guys!
2019-05-01 23:17:46+00:00,this is a translation for i want to go 90 on i4 with my tesla instead of making 2 videos
2019-05-01 23:12:15+00:00,Shoutout to the dude driving the Tesla with a license plate that reads “LOL GAS”.
2019-05-01 22:58:11+00:00,"If you are gonna buy a Tesla let me know. We can both get some free charging if you use my code at purchase. Yup, I’m shameless."
2019-05-01 22:55:49+00:00,Day 249: I’m no longer a pizza boy. @elonmusk @Tesla pic.twitter.com/2iwkpXUep7
2019-05-01 22:47:04+00:00,Yet another potential game changer from @MaryGPowell and @GreenMtnPower. Pilot project uses @Tesla Powerwall as utility meter. https://vermontbiz.com/news/2019/april/30/gmp-pioneers-system-using-energy-storage-make-meters-obsolete …
2019-05-01 22:42:27+00:00,"TODAY ON THE FOUR: A wrongful death lawsuit against @Tesla after a fiery crash on the Peninsula, the victim's family blames the autopilot feature. Plus, @salesforce CEO Marc @Benioff donates $30 Mill to fund a new homelessness research institute at @UCSF ..today at 4p on @KTVUpic.twitter.com/Rme6YWIIkA"
2019-05-01 22:38:46+00:00,I'm beginning to suspect that demonstrating a keen attention to detail may be a career limiting move at Tesla. $TSLAQ
2019-05-01 22:36:30+00:00,"If Tesla burned as much cash as they did in Q1 every quarter, they could continue running for over a year before they ran out of cash. Rumors of them going bankrupt are (as usual) greatly exaggerated. They can easily raise capital and will have positive cash flow this year"
2019-05-01 22:18:17+00:00,"Ark Invest’s Cathie Wood defends #Tesla to $4,000 call https://youtu.be/AWFjfYa28A0 $TSLA #EVpic.twitter.com/GzRQuFsWIC"
2019-05-01 22:11:27+00:00,"Honored for @plumalleyco to host #AlphaGirls @tgr @sonjaperkins @magdalenayesil @mjhelmore and author @JulianGutherie to highlight pioneering women in VC behind some of tech's biggest companies like @F5Networks, Acme Packet, @Tesla , and @salesforce.pic.twitter.com/IaejkO88XI"
2019-05-01 22:09:46+00:00,@JoeSilverman7 The thing about owning a Tesla no one talks about — nightmarish repair delays http://a.msn.com/08/en-us/AAAJmmj?ocid=st …
2019-05-01 21:49:17+00:00,"inside EVs is US only, tesla's guidance is for global deliveries"
2019-05-01 21:42:12+00:00,Should be noted in bold that the Tesla driver just STEPPED OUT OF IT LIKE IT WAS A SMALL BUMP!.. *Also didn't catch fire.... WOW...
2019-05-01 21:40:54+00:00,"""He thought it was the safest car in the world:"" Wife of Apple engineer who died in #Tesla Autopilot crash says she gave him the Model X as a birthday gift. His family is suing Tesla claiming its Autopilot feature was defective and caused his death. https://buff.ly/2DIPEzr pic.twitter.com/dGXtNpdhZK"
2019-05-01 21:38:53+00:00,Because taxpayers are subsidizing Tesla... because it’s not an actual business? Is that close? https://twitter.com/CNN/status/1123700144552271872 …
2019-05-01 21:35:28+00:00,"I’m a fan of Tesla, but I’m not a fanboy and I definitely don’t have any skin in the game. It’s hard to argue in my opinion that Tesla has not already accelerated the transition to sustainable energy. Traditional OEMs would not be where they are if not for the S, X and 3."
2019-05-01 21:35:03+00:00,"Tesla autopilot malfunction caused crash that killed Apple engineer, lawsuit alleges http://gizmo.do/TJVxkdv pic.twitter.com/2q70v0qRBV"
2019-05-01 21:33:46+00:00,Oh so I see Tesla is doing a partnership with $SNC (google Artko and SNC) for insurance. I loved SNC because they were essentially the payday lender of car insurance with predatory rates that had them earning 20%+ ROEs. Perfect. Tesla buyers deserve this relationships.
2019-05-01 21:29:05+00:00,"𝙍𝙀𝙋𝙇𝙔 𝘼𝙉𝘿 𝙏𝘼𝙂 @elonmusk | i just wanna play guitar video came to be by filming the rear view camera of a Tesla in a hospital parking lot @4 in the morning ... somehow, some way, Elon of the Musk clan must see this ... | 𝙍𝙀𝙋𝙇𝙔/𝙏𝘼𝙂 @elonmusk #𝙀𝙇𝙊𝙉𝙈𝙐𝙎𝙆”pic.twitter.com/lWS6N7qPjA"
2019-05-01 21:26:06+00:00,Why Tesla is offering rock-bottom solar panel prices https://cnn.it/2ZR8m1g pic.twitter.com/oMtuRN0dCw
2019-05-01 21:12:18+00:00,$TSLA Liquidity Crunch?: @Tesla does not have money to send an attorney to a court case to defend itself because of budget issues? P.S.: That is not even the most alarming thing about this case. https://twitter.com/pac_watson/status/1123671052159205376 …
2019-05-01 20:57:48+00:00,"For the last 3 hours, my Twitter notification view blew out! Never in my lifetime I would have predicted that Elon Musk would retweeted me! Over half a million impressions so far. This made my day. #Tesla pic.twitter.com/cUNDX6UHUD"
2019-05-01 20:55:06+00:00,"Graduates of Tesla START earn a full time job, certification, and the skills necessary to succeed @Tesla & the growing electric vehicle industry. Friday’s @OfficialEVC ceremony brings the total of Tesla START participants to 172 graduates since the programs inception last year! pic.twitter.com/iVgtnbHo6o"
2019-05-01 20:53:25+00:00,"Fred's all in: $TSLAQ ""Full disclosure: both Seth and I have been buying $TSLA in the most recent decline over the last few months as we think Tesla is still an important part of the electrification story going forward. So much for being anti-Tesla."" https://electrek.co/2019/05/01/tesla-investor-tsla-bull-case/#disqus_thread …"
2019-05-01 20:42:20+00:00,My dear friends at Chesapeake Climate Action Network are raffling a Tesla. Enter @CCAN's raffle to fund their top-notch climate work in the mid Atlantic. Get tickets at: http://www.climatetesla.org
2019-05-01 20:39:37+00:00,Same location beautiful night picture! Photo credit @craigcoker_pic.twitter.com/Lv8mNXPwD2
2019-05-01 20:30:56+00:00,"""The minute you sit inside that car, the definition of what is expected is altered forever"" Would be epic to have two great minds from the VC world debate Tesla. @chamath and @wolfejosh are you in?https://twitter.com/CNBC/status/1123675707509362688 …"
2019-05-01 20:18:40+00:00,I can finally order my model 3 !!! I just need to remortgage if I want to get the long range or performance model !!! What to do hmmmmmmm #model3 #finally #uk #tesla pic.twitter.com/c8PUrDvEwe
2019-05-01 20:18:30+00:00,Fidelity's mutual funds sold more than one million shares of Tesla in March https://bloom.bg/2GSBxs5
2019-05-01 20:12:03+00:00,"The insurance term for this is ""fronting"". Basically, State National is providing access to all the 50 US states insurance licensing etc for a small fee to Tesla. Quick explainer video, http://www.statenational.com/fronting/fronting-explainer/ …"
2019-05-01 20:06:30+00:00,"Tesla is working with State National for the ""plumbing"" of operating the insurance business, but is working with others for actual re-insurance of the risk. Similar to an MVNO, Tesla will be the brand but State National will be the behind the scenes partner."
2019-05-01 20:01:58+00:00,"""Use Tesla’s proprietary technology to lower costs and improve the customer experience by embedded technology to support the underwriting, rating, claims, repair, and product manufacturing network, including direct data feeds with customer permission"""
2019-05-01 20:01:15+00:00,"More details about Tesla Insurance due to some new regulatory filings. According to the filing, “Vehicles equipped with an autonomous feature option will be eligible for credits based on the level of autonomy of the vehicle.” https://www.reinsurancene.ws/tesla-insurance-product-to-be-fronted-by-markels-state-national/ …"
2019-05-01 19:50:51+00:00,28 electric vehicle models now eligible for Canadian gov't rebate up to $5K. Tesla Model 3 just added by sneaking under the $45K MSRP cap. Full list of cars here: http://www.tc.gc.ca/en/services/road/innovative-technologies/list-eligible-vehicles-under-izev-program.html …
2019-05-01 19:41:54+00:00,Tesla investor breaks down TSLA bull case: solid fundamentals and cars are amazing https://electrek.co/2019/05/01/tesla-investor-tsla-bull-case/ … by @fredericlambertpic.twitter.com/UumovNm6s6
2019-05-01 19:40:17+00:00,@3d_Cristina The status today did not happen because the lawyer could not afford the plane ticket to get here. The actual response Tesla gave to not be present...No $$for plane tix. #skiplagged She said the Arbitration agreement does not mean you will skip my courtroom. $tslaq
2019-05-01 19:32:03+00:00,#LosAngeles last chance to see our wild AR experiment @magicleap - May 2nd is last day! Check it out at Westfield in Century City @UnitedNude next to Tesla pic.twitter.com/pZM245EpdC
2019-05-01 19:30:30+00:00,"Because the main lawyer was not present due to ""budget issues"" she gave a deadline that by the end of the week Tesla has to produce the joint status report. The one with the forged signature. With all necessary documents and witnesses including person who wrote the article."
2019-05-01 19:26:21+00:00,. https://youtu.be/LbiI0rYrcZo see behind the scenes of Tesla’s Falcon Heavy Secret Level /// in this video by @LikeTeslaKim I make a cameo appearance at one point too - so does Starman. @MyTeslaAdventur @Sofiaan #tesla #FalconHeavypic.twitter.com/k5sQB8tITr
2019-05-01 19:22:11+00:00,"Tesla Model 3 UK Pricing Becomes Official, Design Yours Today https://insideevs.com/news/347461/tesla-model-3-uk-pricing/amp/ … via @insideevs.com"
2019-05-01 19:22:02+00:00,"#Tesla sneaks past Canada EV incentive law with cheap 93-mile-range #Model3. Over 50 people lined up this AM at the Robson Tesla store. ⁦If Tesla continues to drive costs down and can offer model 3 for a lower price, game over legacy car makers. https://www.engadget.com/2019/05/01/tesla-sneaks-past-canada-ev-incentive-law-with-cheap-93-mile-ran/ …"
2019-05-01 19:20:08+00:00,Judge to Tesla: They have been obstructionists to setting a trial date. The discovery is overdue. Tesla has 27 defenses and not one witness or document. I do not buy that the investigation is ongoing. I am not going to consider arbitration without a response. $tslaqpic.twitter.com/WTEka7sh1E
2019-05-01 19:20:03+00:00,Tesla sued in wrongful death lawsuit that alleges Autopilot caused crash https://tcrn.ch/2V5XNZg by @kirstenkorosecpic.twitter.com/AqASme83Qy
2019-05-01 19:15:04+00:00,Tesla’s best advertisements are the much-hyped competitors from veteran auto https://www.teslarati.com/tesla-best-advertisements-tsla-killers-audi-etron-jaguar-ipace/ …
2019-05-01 19:01:48+00:00,It’s been confirmed with #Tesla online support that 12.1.1 update is a problematic firmware and they are pulling it back. My car was draining like crazy on 4/29 because it tried to download it. New update will be released soon. pic.twitter.com/fB6NRmHWS1
2019-05-01 19:01:02+00:00,"What what a day. I feel like I’ve typed for England today, effectively being an unpaid Tesla employee working from home. It’s so great to see so many new people buying their first EV Orders flooding in from what I’ve seen. Great work @elonmusk / @Tesla pic.twitter.com/oVcQfAtS5E"
2019-05-01 18:58:59+00:00,"You mean like this Dodge Ram? https://youtu.be/cdClmGOaVDc Or this one? https://youtu.be/PpBIpsrEBWk Or this one? https://youtu.be/xnv9nBfVQdU Of course if it was a widespread problem with Dodge, there might be a recall... https://abc7.com/automotive/recall-dodge-ram-pickups-could-erupt-in-flames/2438948/ … Oh and Tesla's are made in the USA."
2019-05-01 18:57:56+00:00,"Despite shipping a huge amount of production to overseas markets, Tesla U.S. vehicle sales still up +74% year-over-year for 2019 year-to-date (Jan-Apr) per @InsideEVs est. (42K '19 YTD vs. 24K for '18 same period). Apr'19 up +98% vs. Apr'18. Source: https://insideevs.com/news/347358/ev-sales-scorecard-april-2019/ …pic.twitter.com/kQyMLegzgl"
2019-05-01 18:57:42+00:00,I was walking in Hollywood and a Tesla pulls up and I told my girlfriend about how dumb having a car like that is and then David Dobrik pulls out of the car lmao.
2019-05-01 18:50:03+00:00,Institutions (And Insiders) Dump Tesla As Retail Bagholders Step Up To The Trough https://www.zerohedge.com/news/2019-05-01/institutions-and-insiders-dump-tesla-retail-bagholders-step-trough …
2019-05-01 18:33:45+00:00,Desert Supercharger by @dinokuznikpic.twitter.com/vPGDD4pnm3
2019-05-01 18:32:59+00:00,Tesla Model 3 remains the most popular electric vehicle in the U.S. — by far https://www.latimes.com/business/autos/la-fi-hy-tesla-deliveries-sales-april-20190501-story.html …
2019-05-01 18:32:31+00:00,It only gets better too. I don’t think the full appeal of Tesla really set in for me until ~4 months of ownership when I realized my car probably had 20 more major features than when I first bought it. Software updates are incredible.
2019-05-01 18:28:11+00:00,"Interesting video from last accident with a Tesla invomved in Spain, where all ""experts"" predicted was a @Tesla fault. Perhaps the owner is alive now due the safest car and RIP to the other driver. pic.twitter.com/F92qedEZo1"
2019-05-01 18:20:21+00:00,Thanks @elonmusk for making the safest car in the world. all good thanks to @Tesla #tesla #tslaq #Security @jorgemilburn @raqueldura @PereBrugal !https://twitter.com/0bsesion1/status/1123642630653599745 …
2019-05-01 18:20:07+00:00,Why Tesla is offering rock-bottom solar panel prices https://cnn.it/2ZPHf6s pic.twitter.com/U5nMwmtfmH
2019-05-01 18:09:31+00:00,"According to Automotive News, Tesla is being sued over a fatal crash which is being blamed on an autopilot navigation error pic.twitter.com/j6eDgmIDp0"
2019-05-01 18:09:05+00:00,The median Tesla employee made 81% more than the median American in 2018 http://www.businessinsider.com/teslas-median-employee-made-81-more-than-the-median-american-in-2018-2019-5 …
2019-05-01 17:44:53+00:00,"Wanna know what can happen when you take money from foreign investors and don't consider the consequences? Here's some inside dish on Lucid Motors, the Tesla rival that took on Chinese and Saudi money. It was ""like binge-watching a Netflix series."" https://www.vox.com/recode/2019/5/1/18511540/silicon-valley-foreign-money-china-saudi-arabia-cfius-firrma-geopolitics-venture-capital …pic.twitter.com/PhVn7G9Ugl"
2019-05-01 17:33:37+00:00,"Tesla Model 3 Hits The UK In June, Starting At £39,850 — Crushes BMW “Equivalent” On Price & TCO https://cleantechnica.com/2019/05/01/tesla-model-3-hits-the-uk-in-june-starting-at-39850-crushes-bmw-equivalent-on-price-tco/ …pic.twitter.com/8h1JV0o133"
2019-05-01 17:32:59+00:00,I really wish #Tesla #Model3 v2019.12.1.1 had #SmartSummon pic.twitter.com/yWa3NDykPD
2019-05-01 17:29:32+00:00,CBC hawking for the Trudeau Liberals and Tesla. It's just infuriating... Big deal! https://twitter.com/CBCAlerts/status/1123608353270370304 …
2019-05-01 17:28:56+00:00,Chamath Palihapitiya talks long term investing with #Tesla on @CNBC Halftime Report. An interesting watch! https://youtu.be/0YAMI0sPmoI pic.twitter.com/GMBI1JPooQ
2019-05-01 17:28:48+00:00,"The Model 3 has landed. In our first UK drive of @Tesla's affordable EV, we ask: how will it fit into Britain's motoring scene? Full report here: https://buff.ly/2vxdyZW pic.twitter.com/9GX6GopCBx"
2019-05-01 17:26:55+00:00,@Tesla infotainment + audio system tops Consumer Reports ratings. @tesla: 86% ⁦ @Lexus⁩: 46% https://www.marketwatch.com/story/teslas-infotainment-dashboard-screen-tops-consumer-reports-ratings-2019-05-01 …
2019-05-01 17:26:33+00:00,"#NewsMafia: What do you think about Tesla? #GeniusInvestor: Elon Musk is great, Tesla is the future #NewsMafia: — deletes interview — #NotBoringhttps://twitter.com/ElonMuskTV/status/1123537250858536960 …"
2019-05-01 17:23:53+00:00,Tesla Gigafactory 3 in Shanghai China （May 01 2019) Labor Day Holiday in China many workers on site working hard! Full Video Here: https://youtu.be/c8mA_xwxxpk via Jason Yang @YouTubepic.twitter.com/eI2swB3ofx
2019-05-01 17:19:23+00:00,"“Tesla was beta testing cars on live subjects. That’s not something that should have happened.” Mark Fong, lawyer for family. #ABC7nowpic.twitter.com/62JsAafag8"
2019-05-01 17:12:55+00:00,1/ Finally got through the Q1 2019 Tesla earnings transcript. Was surprised to see battery production constraints listed as a reason for negatively impacting volumes and revenue. But not really. . . $TSLAQ
2019-05-01 17:11:09+00:00,"Tesla introduces a Canada-only electric vehicle to ensure maximum fleecing of Cdn taxpayers. Priced at $44,999 to get under $45K limit to qualify for $5K kickback. Range is 150km. This is the kind of stupid result bad policy enables."
2019-05-01 17:08:46+00:00,#Tesla #Semi on the 101pic.twitter.com/2s4cw7DsU0
2019-05-01 17:08:07+00:00,The thing about owning a Tesla no one talks about — nightmarish repair delays http://www.msn.com/en-us/autos/news/the-thing-about-owning-a-tesla-no-one-talks-about-nightmarish-repair-delays/ar-AAAJmmj?ocid=ob-tw-enus-1550268740751 …
2019-05-01 17:04:17+00:00,Tesla Gigafactory 3 drone video update: it is starting to look like a factory only 3 months in https://electrek.co/2019/05/01/tesla-gigafactory-3-drone-video-update/ … by @fredericlambertpic.twitter.com/11ZRsm8zq8
2019-05-01 17:00:50+00:00,"I’m sure it will surprise no one that I’m making nerdy collages of the superchargers we’re visiting on this trip. Here are the first 27 (not all of which we actually needed, but if a new one is right on our route we always stop by). #teslajoyride @tesla pic.twitter.com/c8LShYlGkq"
2019-05-01 16:55:06+00:00,"Musk’s Tesla is the clear winner"" in electric cars, @chamath says.https://cnb.cx/2GUqG0O"
2019-05-01 16:53:02+00:00,The criticism around Tesla selling emission credits proves that analysts don't understand the company's business http://www.businessinsider.com/criticism-of-tesla-selling-emission-credits-proves-analysts-dont-understand-its-business-2019-5 …
2019-05-01 16:51:00+00:00,"GOV'T: We're doing a rebate on electric vehicles priced under $45k TESLA: ok cool here's a version of the Model 3 priced at $44,999 that nobody should buy and exists exclusively to qualify for the rebate http://business.financialpost.com/wcm/436fd8ed-0645-4333-94d9-ade7af63713e … via @nationalpost"
2019-05-01 16:49:41+00:00,“Elon Musk and Tesla should be held to account for the way they have rolled out and promoted Autopilot. But users like Walter Huang are probably not the poster children for this accountability.” https://www.forbes.com/sites/samabuelsamid/2019/05/01/the-problem-with-blaming-tesla-for-walter-huangs-death/ …
2019-05-01 16:45:06+00:00,Is @Tesla opening a service center in Pearl? Mums the word among people here but we found this building on Airport Rd with Tesla written all over it. The front door was open and they were receiving Fed Ex packages but a security guard said we couldn’t go in. @elonmuskpic.twitter.com/RiCD0itvZj
2019-05-01 16:45:00+00:00,Tesla is being sued by the family of the Silicon Valley driver killed last year in a Model X Autopilot crash http://on.forbes.com/6014EgR4O pic.twitter.com/siLTxpBj89
2019-05-01 16:33:34+00:00,"Whoops, CNBC accidentally put a guy on the air who makes a rational, fact-driven case for why he believes in Tesla as a stock! The host, meanwhile, effectively admits that he's a short himself and a Chanos shill."
2019-05-01 16:31:51+00:00,"My condolences to Tesla shorts on the death of their ""no demand"" hopes. S/X sales are well above Jan. '19 sales, and that's before the refreshed S/X and the return of the standard range version has had time to be produced and delivered. $TSLA $TSLAQhttps://insideevs.com/news/347137/tesla-model-3-s-x-sales-april/amp/ …"
2019-05-01 16:30:47+00:00,"If you think Tesla is a car company, it appears overvalued. If you think Tesla is a tech company, it appears undervalued. pic.twitter.com/bxlfSAXo9N"
2019-05-01 16:21:41+00:00,"If Apple's Q1 2019 Revenues were reported like @Tesla's this is how the headlines would read: Apple Q1 Revenues Crash 31%, down from $84 Billion in Q4 to $58 Billion in Q1! At that rate of decline, they are about to go bankrupt!"
2019-05-01 16:12:02+00:00,"April 2019 was a record first month of a quarter for overall Tesla registrations in Norway, Netherlands and Spain, with 1,271 vehicles registered! (source: http://eu-evs.com ) $tslapic.twitter.com/NGfWszX9a6"
