date,tweet2019-05-02 06:52:03+00:00,"Gil, CEO of $QNT brings the to @elonmusk in a respectful way. Can you imagine if someone like Elon actually did onboard #Overledger; it's not implausible. I mean, just look what @elonmusk has achieved. Nothing is impossible. This #TESLA- #interoperability tech-combo can workhttps://twitter.com/gverdian/status/1123661871331016704 …"
2019-05-02 05:24:01+00:00,"Tesla’s Standard Range Model 3s now qualify for Canada’s $5,000 federal rebate https://mobilesyrup.com/2019/05/01/standard-range-model-3-telsa-canada-5000-federal-ev-rebate/ …pic.twitter.com/mgIpk5ylOm"
2019-05-02 04:33:10+00:00,Tesla’s ground breaking occurred January 7th..... of 2019....... https://twitter.com/cleantechnica/status/1123724034255073286 …
2019-05-02 04:28:48+00:00,Why Tesla is offering rock-bottom solar panel prices - CNN https://www.cnn.com/2019/05/01/investing/tesla-solar-panel-costs/index.html …
2019-05-02 04:03:09+00:00,"From Q1 @Tesla call, ""We’re seeing an increased take rate on our FSD offering. And there are, revenue associated with that given that the full suite of functionality is not there. And as that option approaches, we will be able to apply more revenue on that."" #AccountingEthics"
2019-05-02 04:00:01+00:00,The problem with blaming Tesla for Walter Huang's death: http://on.forbes.com/6015EgTkz pic.twitter.com/tiGcG2gVvT
2019-05-02 03:54:24+00:00,"Well, I did it. I bought a Tesla Model 3 pic.twitter.com/39TTcTYxmT"
2019-05-02 03:52:05+00:00,"It looks like diving for left exits IS actually a thing after all. Restricted access road, where AS use is permitted even by Tesla manual (but of course need to remain vigilant). firmware 19.12 pic.twitter.com/RAQryYZ1md"
2019-05-02 03:50:27+00:00,You can read @skabooshka's response to Tesla's restraining order thanks to @PlainSite. He denies the company's allegations and says Tesla has evidence that can prove his innocence. He requests limited discovery and an evidentiary hearing. https://www.plainsite.org/dockets/3xt7dv6u8/superior-court-of-california-county-of-alameda/tesla-inc-v-hothi/ …
2019-05-02 03:46:00+00:00,Tesla sued by family of man killed in Autopilot-related crash https://www.theverge.com/2019/5/1/18525330/tesla-autopilot-lawsuit-model-x-crash-walter-huang?utm_campaign=theverge&utm_content=chorus&utm_medium=social&utm_source=twitter …pic.twitter.com/cLts3gWTKx
2019-05-02 03:40:25+00:00,"Watch how @Tesla performs when traffic suddenly comes to a complete stop on a highway. While all other ""Vehicles"" almost collide into each other. Velocity 105klm to 5klm. RT to share the TesLove or RT so the haters can fall in love #ElonMusk #TeamTesla #WhyWeWantaTeslaToWTruckpic.twitter.com/OdHZCxgun6"
2019-05-02 03:37:14+00:00,How does Tesla’s median employee income stack up against the median American? https://www.teslarati.com/tesla-tsla-median-earnings-81-percent-us-average/ …
2019-05-02 03:21:58+00:00,This just got 10x juicer. Tesla is going to pay the price for barking up the wrong goddamn tree. https://twitter.com/orthereaboot/status/1123789267736592385 …
2019-05-02 03:16:57+00:00,"“Skabooshka is part of a loose confederation of skeptics who increasingly use the name “$TSLAQ"" to refer to themselves.” Dana is too nice when describing the $TSLAQ #DumDums. Glad she’s putting a spotlight on their smear campaign against @Tesla $TSLAhttps://twitter.com/danahull/status/1123777152766418944 …"
2019-05-02 03:11:25+00:00,I will never see that logo the same way again now.
2019-05-02 03:09:03+00:00,"Yeah, neighbors. Yeah. I’m the guy in the gold and black matted Tesla BUMPING “Ballin’ Oats” by @scottmelker. And I’ve got one thing to say... you’re welcome.https://youtu.be/LGdacWqq4KM"
2019-05-02 03:07:59+00:00,The pups that were rescued & transported by @thedogist on 4/11/2019 are now available for adoption! Fun Fact: the journey from Fresno to San Diego happened on the same day as the 2nd ever @SpaceX #FalconHeavy launch! @Tesla #ModelX #AdoptDontShop #SanDiego #SoCalhttps://twitter.com/HWAC/status/1123658339253014528 …
2019-05-02 02:56:09+00:00,"$TSLA-“Tesla’s ( @elonmusk) accusations here fall into a long and disturbing pattern of using lies and intimidation in an effort to silence its critics,” Tesla Skeptic Says Allegations of Menacing Workers Aren't True https://www.bloomberg.com/news/articles/2019-05-02/tesla-skeptic-says-allegations-of-menacing-workers-aren-t-true …"
2019-05-02 02:54:50+00:00,"California man who Tesla accused of spying and harassing employees says carmaker is trying to silence his criticism. ""Mr. Hothi endangered no one, threatened no one, and harassed no one,” his lawyer says. https://bloom.bg/2ZOxFRt"
2019-05-02 02:47:12+00:00,i cannot believe a man who owns a tesla is riding the subway PLEASE say sike pic.twitter.com/2vyRGAgNJB
2019-05-02 02:46:40+00:00,Tesla Skeptic Says Allegations of Menacing Workers Aren't True ! BOOM ! ⁦ @TeslaCharts⁩ ⁦ @zerohedge⁩ ⁦ @markbspiegel⁩ ⁦ @CGrantWSJ⁩ https://www.bloomberg.com/news/articles/2019-05-02/tesla-skeptic-says-allegations-of-menacing-workers-aren-t-true …
2019-05-02 02:36:05+00:00,"“Tesla paid off $900M in debt. That’s usually cause for celebration. That debt payment was larger than the loss, so there would have been a profit otherwise.” pic.twitter.com/xu9Q6yo4Yv"
2019-05-02 02:32:06+00:00,. @skabooshka's attorney has filed response to Tesla's restraining order: https://www.bloomberg.com/news/articles/2019-05-02/tesla-skeptic-says-allegations-of-menacing-workers-aren-t-true …
2019-05-02 02:30:37+00:00,Green Mountain Power Plans 100% Renewables By 2030 With Help From Tesla https://cleantechnica.com/2019/05/01/green-mountain-power-plans-100-renewables-by-2030-with-help-from-tesla/ …pic.twitter.com/G0iguB0RLz
2019-05-02 02:27:25+00:00,"Jeff Keith TESLAat Hampton Beach, NH 4.19.19 SHOCK Tour. I love moments like this when the band sees me in the pit. There was no shortage of band interaction that night. A great band since day one. Tesla puts on a great show every time. And a lot of fun to @TeslaBandpic.twitter.com/cV43hHMtBi"
2019-05-02 02:22:29+00:00,Mark my words. Tesla is going to work to scrub this video! No airbags deployed and that car had to be hauling ass! Probably on AP... $TSLA
2019-05-02 02:17:59+00:00,Apple has $225 billion in cash. Apple could buy: Tesla Uber Lyft Spotify Twitter ...and still have $13 billion left. $AAPL
2019-05-02 02:15:41+00:00,"New Tesla full self driving feature rolled out via latest OTA update: ""Navigate to Final Destination"" https://twitter.com/Alias_Analytics/status/1123768682344341505 …"
2019-05-02 02:00:23+00:00,Tesla owners... You cant drive the $30k Tesla with the arrogance of the $150K Tesla. You basically driving a top of the line Honda Accord EX.
2019-05-02 01:57:47+00:00,"If @Tesla sold an additional 30,000 cars in Q1 at an average profit of $20k per car, they still would have lost money. That also happens to be @elonmusk s best case for Q2 $TSLAQ"
2019-05-02 01:57:21+00:00,After listening to @chamath I'm like this about @tesla stock pic.twitter.com/ST1PgfHaCI
2019-05-02 01:54:18+00:00,So true. There is not one EV better than a @tesla 2012 model S https://twitter.com/Tesla/status/1040679044298170368 …
2019-05-02 01:18:06+00:00,"Like I said, I'm all for autonomous/semi-autonomous vehicles, just as soon as the software that controls them is no longer in beta. If you've been keeping score, @Tesla Autopilot has been responsible for 4 fatalities, with 3 of them being drivers. https://gizmodo.com/tesla-autopilot-malfunction-caused-crash-that-killed-ap-1834453661 …"
2019-05-02 01:12:47+00:00,Something very satisfying seeing a full truck of @Tesla cars going out to new owners. pic.twitter.com/SWlIJ0hvXM
2019-05-02 01:07:52+00:00,Wireless energy and comms. Funded by thief's. Retribution. Controlled by we the people. Tesla zenneck surface wave technology. Viziv All in one. pic.twitter.com/9M6pRa6QBq
2019-05-02 01:00:15+00:00,Why Tesla is offering rock-bottom solar panel prices https://cnn.it/2GOfCSO pic.twitter.com/idSAY0PzCN
2019-05-02 00:54:51+00:00,". @russ1mitchell "" @Tesla outsells other electric car makers, but it can’t sell its cars at a profit."" What? $TSLApic.twitter.com/TfnoN2C7Kx"
2019-05-02 00:50:37+00:00,#Tesla's infotainment system gets highest rating on Consumer Reports satisfaction survey https://www.consumerreports.org/automotive-technology/choose-an-infotainment-system-you-will-love/ … $TSLA #EVpic.twitter.com/PTvYgySebz
2019-05-02 00:46:06+00:00,Craving the latest on Tesla? Self-driving cars? Those ubiquitous scooters? Then our new weekly Transportation newsletter is for you. Hop in! https://wired.trib.al/YQA6cvb #readhappy pic.twitter.com/AhtShD1k54
2019-05-02 00:37:56+00:00,if I let a Tesla back me will I give birth to Megatron or wall-e?
2019-05-02 00:33:45+00:00,"8.5% Tesla bonds! In other words, pricing in a high risk of default. https://twitter.com/carlquintanilla/status/1123722411751374848 …"
2019-05-02 00:24:37+00:00,WTF is going on w/ #Tesla Japan? They basically stopped tweeting in Oct. 2017. Just 2 tweets since. I guess that's what happens when no PR manager or Sales director for 6 month. They're not even trying to sell cars anymore. $TSLA $TSLAQ #テスラpic.twitter.com/Pq2YI37l3u
2019-05-03 23:44:00+00:00,Tesla email ordering workers not to leak to journalists ... leaks. https://cnb.cx/2GZryCq
2019-05-03 23:43:11+00:00,"This could be the end of the war against the worker. The Union is not playing with $tsla. Stand strong tesla workers. You are not slaves. You are about to get some help. Dont worry about getting fired, minimum wage jobs are everywhere. $tslaqhttps://twitter.com/lorakolodny/status/1124444571012718592 …"
2019-05-03 23:41:45+00:00,harry: oh well my $12 juice spilt in my $95000 car maybe i’ll just buy a new tesla tomorrow pic.twitter.com/MSwzo8NBcR
2019-05-03 23:32:15+00:00,Please push new update to me @Tesla! This is what 2019.8.5 is doing to me. pic.twitter.com/eMsOn5mphe
2019-05-03 23:30:56+00:00,"Let's be clear, 1 million Tesla robo-taxis by end of next year is Theranos quality fraud. If you have the least bit of technical knowledge of how hardware devices and/or software programs work together, or at least don't believe that science is magic, this is clearly a fraud."
2019-05-03 23:11:56+00:00,I GOT A TESLA. pic.twitter.com/3LdlBd964D
2019-05-03 23:01:57+00:00,"Tesla Talks Mineral Shortages, Europe Plans New Battery Factory https://cleantechnica.com/2019/05/03/tesla-talks-mineral-shortages-europe-plans-new-battery-factory/ …pic.twitter.com/miNhThz0u2"
2019-05-03 22:51:05+00:00,"In leaked email, Tesla urges employees to stop leaking. https://www.cnbc.com/2019/05/03/tesla-email-warns-employees-stop-leaking.html?__source=twitter%7Cmain …"
2019-05-03 22:45:29+00:00,"hey any disgruntled and Tesla employees who have integrity, especially those who work in accounting/finance Elmer DMs aint closed https://www.cnbc.com/2019/05/03/tesla-email-warns-employees-stop-leaking.html?__source=twitter%7Cmain …"
2019-05-03 22:44:11+00:00,"In a new email sent to Tesla employees, the company reminds them how many people they're fired or sued over, basically, loose lips. https://twitter.com/CNBC/status/1124441098745786369 …"
2019-05-03 22:42:37+00:00,U.S. technology companies founded by 1st and 2nd generation immigrants: Apple Google Amazon Facebook Oracle IBM Uber Airbnb Yahoo Intel EMC eBay SpaceX VMWare AT&T Tesla NVIDIA Qualcomm Paypal ADP Reddit SlackHQ WeWork Stripe Cognizant Intuit Zoom Netsuite 3M @IlhanMN
2019-05-03 22:38:47+00:00,. @lorakolodny got ahold of the Tesla email asking employees to stop leaking Tesla emails https://www.cnbc.com/2019/05/03/tesla-email-warns-employees-stop-leaking.html …
2019-05-03 22:30:23+00:00,Here's the email Tesla sent employees telling them to stop leaking info https://cnb.cx/2ZTQ27x
2019-05-03 22:23:07+00:00,"Arcadia, CA should be renamed Tesla Nirvana as I have never seen so many in one area before! They all were so clean I finally felt guilty enough mine to get mine hand-washed. Fasching’s did a great job making it shine! #TeamRed #tsla $tesla @Model3Owners @elonmuskpic.twitter.com/6654EhbqVD"
2019-05-03 22:13:59+00:00,"Tesla torched over $4 billion getting the Model 3 into production and just raised another $2.7 billion pivoting to robotaxis. Sometimes you’ve just gotta laugh at the absurdity of it all. This is still the greatest game in the world, and I’m not going anywhere $TSLA $TSLAQ"
2019-05-03 22:11:02+00:00,Tesla completes its $2.35 billion stock and bond sale https://on.mktw.net/2ZWpemY
2019-05-03 22:09:14+00:00,"Tech Review 1) Tesla $TSLA Going To $4,000? Ark Invest's Cathie Wood, 2)Data Explosion, 3) Investor Notes, 4 ) ICYMI Tech News https://www.domainmondo.com/2019/05/tech-review-tesla-tsla-going-to-4000.html … #tech #stocks #startups #investors $GOOGL $MSFT $AMZN #ElonMusk #Tesla pic.twitter.com/wiSOZhzLGI"
2019-05-03 22:03:01+00:00,Tesla’s new safety features really push you to stay in your lane https://www.theverge.com/2019/5/3/18527927/tesla-autopilot-lane-departure-avoidance-emergency-self-driving?utm_campaign=theverge&utm_content=chorus&utm_medium=social&utm_source=twitter …pic.twitter.com/l02zaNSP7B
2019-05-03 22:02:17+00:00,"So here is what the highly ethical company known as #Tesla is doing (when not killing its customers or burning down their houses): It's taking a phony 6-year ""gas savings"" number and dividing it into the 3-year term of the lease and subtracting it from the payments!!! ROTFLMAO! https://twitter.com/glenntongue/status/1124432841436270593 …"
2019-05-03 23:58:39+00:00,"WE HOLD THESE TRUTHS TO BE SELF-EVIDENT, THAT ALL TESLA SHORT-SELLERS ARE CREATED EQUAL, THAT THEY ARE ENDOWED BY THEIR MARGIN CLERK WITH CERTAIN UNALIENABLE RIGHTS, THAT AMONG THESE ARE LIFE, LIBERTY AND THE PURSUIT OF NOT COVERING #NOTCOVERING $TSLA $TSLAQ"
2019-05-03 23:46:00+00:00,Tesla’s new Lane Departure Avoidance feature will steer owners out of harms way even without Autopilot https://www.teslarati.com/tesla-autopilot-lane-departure-avoidance-safety/ …
2019-05-03 23:31:50+00:00,If this isn’t a commercial for Tesla then I don’t know what is. pic.twitter.com/Fid0A9L2lr
2019-05-03 23:11:03+00:00,Yet another spontaneously combusting Tesla. Four wheeled fire lighters. Unplugged Tesla Model S Spontaneously Ignites While Parked In San Fran Garage | Zero Hedge https://www.zerohedge.com/news/2019-05-03/unplugged-tesla-model-s-spotaneously-ignites-while-parked-san-fran-garage …
2019-05-03 23:07:55+00:00,i want a tesla and ima get one
2019-05-03 23:03:46+00:00,"If you look at Tesla's aggressive responses to critical reporting and efforts to intimidate and smear whistleblowers, it's clear that this isn't just about protecting IP and trade secrets. It's about controlling the company's most important asset: the story."
2019-05-03 22:54:50+00:00,"$TSLA - @elonmusk maybe you shouldn’t threaten your employees, pay them back pay, have a functional clinic, and just plain lie to the public markets in your tweets? If anyone should abide by the Tesla NDA, it is you. You set the example. This is a reflection of you. https://twitter.com/lopezlinette/status/1124444972080668678 …"
2019-05-03 22:54:33+00:00,"I can't help but find this ironic, given how effective Tesla has been at scaring sources into silence. The stories that never saw the light of day due to sources refusing to go on the record or corroborate reports for fear of identification/retaliation are pretty wild. https://twitter.com/CNBC/status/1124441098745786369 …"
2019-05-03 22:53:21+00:00,Me acting shocked that Harrys has a Tesla when he literally owns a Maserati https://twitter.com/hrrygala/status/1124422721105006592/video/1 …
2019-05-03 22:51:11+00:00,IS HE DRIVING A FUCKIN TESLA THATS HOT (don’t @me if I’m wrong lmao) pic.twitter.com/fFPwh88bfJ
2019-05-03 22:50:00+00:00,Omerta is the key to any criminal organization. Tesla email warns employees: stop leaking https://www.cnbc.com/2019/05/03/tesla-email-warns-employees-stop-leaking.html …
2019-05-03 22:48:35+00:00,"Now, ⁦ @marketofchoice⁩, we know the parking isn’t actually FREE. Can I get a rebate if I take the bus? I’d rather not pay for someone else to park their Tesla in your expensive parking structure. pic.twitter.com/QUmFwfLM11"
2019-05-03 22:34:45+00:00,so harry’s jus driving around la in a tesla n i haven’t seen him it rlly is a sick world
2019-05-03 22:33:31+00:00,Here’s the email Tesla sent employees telling them to stop leaking info $TSLA @tesla @elonmusk @cnbc https://cnb.cx/2GXUskZ
2019-05-03 22:31:14+00:00,Happy Friday from Maggie Maye & her knight in shining armor! @boringcompany #Tesla #SpaceX #TheBoringCompany #BoringBricks #GermanShepherd #GSD @BoredElonMusk https://www.instagram.com/p/BxBCqp5A0D7/?utm_source=ig_share_sheet&igshid=1gzcqjwgbeve9 …pic.twitter.com/zEGgSMqTWi – at The Boring Company Tunnel
2019-05-03 22:22:39+00:00,"Tech Review 1) Tesla $TSLA Going To $4,000? Yes says Ark Invest's Cathie Wood, 2) Data Explosion, 3) Investing, $BRK Annual Meeting, 4 ) ICYMI Tech News https://www.domainmondo.com/2019/05/tech-review-tesla-tsla-going-to-4000.html … #StockMarket #investing #technology #Google #Microsoft #Amazon $BRKA $BRKB #Tesla pic.twitter.com/MjKrZWnMS5"
2019-05-03 22:16:14+00:00,"2nd part of the above interview- Why I disagree with @ToneVays and think #IOTA is ""hard money"". Also how #Jaguar/ #Landrover powered data can help reduce emissions. Also- #IOTA, City planning, Autonomous vehicles and #Tesla/ #Tatamotorspic.twitter.com/Ce41Tpp29P"
2019-05-03 22:11:55+00:00,"harry is co-hosting the met in 3 days and he hasn't arrived in nyc yet, he is driving his tesla in la and getting smoothie while we're all freaking out"
2019-05-03 21:49:04+00:00,"Here's how Barra's Chevy Bolt ""crushed"" Tesla Model 3: pic.twitter.com/nWr8Lp1tuj"
2019-05-03 21:46:34+00:00,"IM GEEKING OUT! Didn't know that @joerogan had @RebuildsRich on the podcast. If you haven't watched, its very interesting to hear how Rich took a trashed water-soaked @Tesla and brought it back to life. So amazing. https://youtu.be/qAfWYD7HK9M"
2019-05-03 21:44:30+00:00,okay so jokes apart i really wanna hug him from behind n cuddle him til he pushes me away n run me over with his tesla......it’s what I DESERVE pic.twitter.com/8fCZ7Hb7xy
2019-05-03 21:44:06+00:00,How you driving a Tesla and going 20 mph??? Bitch step on it before I effective. Power لُلُصّبُلُلصّبُررً ॣ ॣh ॣ ॣ 冗 your ass
2019-05-03 21:27:12+00:00,"Knee tattoos, design on a thumb nail, wearing a very on brand hoodie, tipping one of the drinks over, and getting in a Tesla...random, yet endearing things that make up this beautiful unicorn of a human pic.twitter.com/aSVtsbyoXT"
2019-05-03 21:25:29+00:00,i spilled a smoothie on my car can i get another one. - ok here I’ll make you another smoothie. Tesla i want another tesla.
2019-05-03 21:20:21+00:00,harry did nothing but show up in a hoodie and beanie with green drinks and knee tattoos and his tesla and my entire day and year is made. thank you best friend.
2019-05-03 21:20:16+00:00,harry spilling his green juice on his tesla . environmentalist king
2019-05-03 21:11:55+00:00,This offer still stands with your Tesla sir https://twitter.com/harryperrito/status/1024357591844114432 …
2019-05-03 21:10:33+00:00,U.S. rejects Tesla bid for tariff exemption for Model 3 'brain' https://reut.rs/2Yb2jTz pic.twitter.com/54TW123PSP
2019-05-03 21:09:20+00:00,Wayament.... hawld awn... if my calculations are correct and if Harrys car is a 2018 Tesla model s then prices START at 85k
2019-05-03 21:04:56+00:00,"this man is co-hosting the met gala in 3 days and he really spilled his drink on his $250,000 tesla pic.twitter.com/OGrZWlmWM5"
2019-05-03 21:01:18+00:00,Harry has a yellow vintage Ferrari and a black Tesla and an Audi and a Range Rover and a vintage Mercedes like god damn my son has taste
2019-05-03 20:57:31+00:00,"harry drives a tesla, no het but that’s hot"
2019-05-03 20:53:34+00:00,"Harry is still in LA, wearing a “don’t trip” black hoodie, one of his hands fingernails painted white, new tattoos on his knees, driving his black Tesla & looking good days before the Met Gala. Ugh king!"
2019-05-03 20:52:43+00:00,harry styles has a tesla omg it can only mean one thing and one thing only; he’s a david dobrik fan pic.twitter.com/R0WLHPk9Ls
2019-05-03 20:46:20+00:00,oh my god harry owns a Tesla that’s mad hot the rich daddy jumped out pic.twitter.com/pa8ohfleiq
2019-05-03 20:32:06+00:00,A Tesla Model S caught fire in a garage in San Francisco http://www.businessinsider.com/tesla-model-s-catches-fire-in-san-francisco-garage-2019-5 …
2019-05-03 20:31:39+00:00,Elon Musk is helping to fund Tesla's $TSLA needs by borrowing $1.6 billion at 2% in the form of a convertible bond offered by Goldman Sachs $GS. That's incredibly cheap money. @jimcramer salutes @elonmusk for what he didhttps://realmoney.thestreet.com/jim-cramer/jim-cramer-occidental-tesla-and-the-science-of-borrowing-money-14948056 …
2019-05-03 20:30:09+00:00,Why Tesla slashed its solar panel prices http://bit.ly/2ZXGF6C
2019-05-03 20:22:52+00:00,Liking the new @BritomartNZ seating in #takutai. Seen them well used during week. Ppl do want to sit and linger. Brings life to this space much better than a Tesla exhibition! pic.twitter.com/kIc2CN2bEP
2019-05-03 20:13:21+00:00,The structure of Tesla’s capital raise was genius. They were able to leverage the low share price to their advantage.
2019-05-03 20:08:42+00:00,"""The White House has refused to exempt the “brain” of Tesla’s Autopilot technology from punitive import tariffs, a decision that could endanger the company’s self-driving ambitions, TechCrunch has learned."" https://techcrunch.com/2019/05/03/trumps-tariffs-could-knock-teslas-autopilot-off-course/ …"
2019-05-03 20:07:27+00:00,"USTR REJECTS TESLA REQUEST FOR EXCLUSION FROM U.S. TARIFFS ON CHINESE-MADE 'BRAIN' FOR AUTOPILOT SYSTEM-DOCUMENT So Tesla's autopilot has a Chinese ""brain"""
2019-05-03 20:03:00+00:00,Tesla closes at $255. This capital raise and turn of events calls for a celebration tonight. Let’s get wild
2019-05-03 20:02:48+00:00,$TSLA - Another Tesla catches fire inside garage of San Francisco home @CCTV @globaltimesnews @PDChina @shanghaidaily @shanghaiist @ThatsShanghai @XHNewshttps://www.kron4.com/amp/news/national/tesla-catches-fire-inside-garage-of-san-francisco-home/1975931200 …
2019-05-03 19:55:30+00:00,Trump’s tariffs could knock Tesla’s Autopilot off course https://tcrn.ch/2vDtKZT pic.twitter.com/XCh2nHLz5N
2019-05-03 19:51:11+00:00,A new Tesla doesn’t come with a “new car smell”. It comes with an Elon Musk.
2019-05-03 19:49:39+00:00,After $30 mil in gains and $100 mil in commissions on Tesla today. How long till the first Wall Street firm upgrades Tesla. Just watch how it works. $tsla
2019-05-03 19:46:12+00:00,"Hinky. via @TheDrive ""Video of Tesla Model 3 skewered by Guard Rail has us scratching our heads"" https://www.thedrive.com/news/27778/shocking-video-of-tesla-model-3-skewered-by-guardrail-has-us-scratching-our-heads …"
2019-05-03 19:46:02+00:00,I’m @DalhousieU lab tour and at the lab where they work on @Tesla batteries with Professor Jeff Dahn. Here is what a Tesla battery looks like. 9000 of these are in my Model S pic.twitter.com/GVJWvNLYed
2019-05-03 19:44:00+00:00,"I'm so, so sorry. It's all 100% my fault, everything ever."
2019-05-03 19:39:02+00:00,$2.34 billion fundraise gives Tesla much-needed breathing room http://arstechnica.com/cars/2019/05/2-34-billion-fundraise-gives-tesla-much-needed-breathing-room/ … by @binarybits
2019-05-03 19:37:31+00:00,"When you have to charge you have to charge. Again we are hogging spots for 3 Tesla’s! (@Tesla Supercharger in Hays, KS) https://www.swarmapp.com/c/5esSjzEKvvr pic.twitter.com/1RdHxGGyca"
2019-05-03 19:30:10+00:00,Tesla developing new battery recycling process at Gigafactory https://zurl.co/O3Ki - @Tesla #EV #batterypic.twitter.com/0Ve5rVSpdB
2019-05-03 19:29:55+00:00,Good grief. Seeing 16 year olds driving Tesla’s. Lol. I had a old pick up truck when I was their age
2019-05-03 19:29:28+00:00,""" $TSLA - After Tesla's 86% Model 3 April Sales Decline In Norway, Volkswagen's e-Golf Now Outsells It"" https://seekingalpha.com/article/4259777-teslas-86-percent-model-3-april-sales-decline-norway-volkswagens-e-golf-now-outsells?source=tweet …"
2019-05-03 19:01:03+00:00,Luna and I drove to Georgia to celebrate @LikeTeslaKim hitting 100k YouTube subscribers—PARTAY tonight! I can’t believe Kim can actually drive the tiny toy Tesla haha amazing #youtube #tesla #models #toyreviews pic.twitter.com/0ImKuKNZPA
2019-05-03 18:59:49+00:00,"Tesla slashes Model 3 monthly lease payment to $399, but increase cash down https://electrek.co/2019/05/03/tesla-model-3-monthly-lease-payment-399/ … by @fredericlambertpic.twitter.com/Bcg4E7icTF"
2019-05-03 18:50:05+00:00,Family Of Man Killed In Tesla Crash Sues Musk For Treating Drivers Like Lab Rats http://ow.ly/CUzD30oCrZY
2019-05-03 18:47:35+00:00,bro the cell service at nobu is awful rn my iPhone X isn’t loading my favorite website (stock market site). May have to see if my Tesla is close enough to connect to its mobile hotspot
2019-05-03 18:39:56+00:00,"At Autonomy Day, someone asked @elonmusk how much Tesla is spending on autonomy. His answer: “It’s basically our entire expense structure.” It was a profound statement that was clearly lost on the Wall St audience. 5/5"
