date,tweet2019-05-01 05:18:27+00:00,"Haters? Out of every vehicle brand out there, Tesla has BY FAR the largest amount of bots & fan boys backing it. Bunch of insecure nerds that can't handle the fact that the Dodge Ram is the most fuel efficient truck in America."
2019-05-01 05:17:26+00:00,"$TSLA - 1/ @elonmusk & @karpathy , Walter Huang’s death is on you. His family is finally suing you and Tesla for their loss. @elonmusk , you have been stating that the cars would drive themselves since 2015 Let’s revisit this unfortunate and preventable tragedy:https://twitter.com/abc7newsbayarea/status/1123395563163021316 …"
2019-05-01 05:08:09+00:00,“The common stock... is controlled by a bunch of vulture-like venture and hedge funds who like to prey on that company (Tesla).”
2019-05-01 05:04:47+00:00,"Public not supposed to see this great interview focusing on the essentials, the core of $TSLA Apparently censored by #CNBC to keep the negative narrative on #Tesla going. Watch & share please!! #Tesla ⁦ @elonmusk⁩https://streamable.com/goa06"
2019-05-01 05:03:24+00:00,"Got new software yay !!! ... my car is newer now !!! Love this ownership experience of my @Tesla Model 3. To be fair, I don’t even remember what was my car like when I bought it 10 months ago. Gotta love these software updates ..."
2019-05-01 04:51:53+00:00,. @elonmusk and @tesla are slashing prices on their Solar panels. pic.twitter.com/GB0ufAvVMd
2019-05-01 04:50:50+00:00,Did you see @CNBC edit out @chamath Tesla segment today?
2019-05-01 04:49:58+00:00,Report: Tesla to slash solar panel prices by 38% to stymie market share loss https://arstechnica.com/cars/2019/04/report-tesla-to-slash-solar-panel-prices-by-38-to-stymie-market-share-loss/ …
2019-05-01 04:48:07+00:00,2019.12.11 thank you @Tesla Reaching the big 10k tomorrow. #TeamTeslapic.twitter.com/ecbmPCRIMK
2019-05-01 04:45:01+00:00,Tesla's new drastically reduced solar panel prices are now live https://www.theverge.com/2019/4/30/18523750/tesla-solar-panels-price-slash-decline-sales-roof …pic.twitter.com/P7TWG1iYhi
2019-05-01 04:35:09+00:00,"One of the best features about having a Tesla, all the cameras to record incidents like this! https://twitter.com/jayxxchang/status/1123347859896664064 …"
2019-05-01 04:19:26+00:00,"The segment CNBC apparently doesn't want you to see. Palihapitiya schooling Scott Wapner on Elon Musk, Tesla, $TSLAQ #dumdums, and Twitter FUD. Bonus director's cut: Schooling once / decade Jim Chanos. Someone re-posted the vid: https://streamable.com/goa06 https://gofile.io/?c=Hf07nr"
2019-05-01 04:17:36+00:00,AGAIN: The people dumping shares in Tesla are not short-sellers (short interest lower than usual)— but large institutional holders + Tesla Board of Directors members. The people buying the shares are Robin Hood account retail millennials. https://twitter.com/Paul_M_Huettner/status/1123424897047367681 …
2019-05-01 03:52:25+00:00,"@chamath - I hope you know @cnbc is doing some really shady things with it’s $TSLA narrative. Your interview today was available in full just a few hours ago, but now its edited to cut off right as you begin talking about Tesla. https://www.cnbc.com/video/2019/04/30/watch-cnbcs-interview-with-investor-chamath-palihapitiya.html …"
2019-05-01 03:32:52+00:00,"Welcome Tre and Jenny (taking the photo) to the #TeslaFamily! They walked into the Santa Barbara showroom today, and took delivery same day! Great job @Tesla! Congrats on their new dual motor #Tesla #Model3! pic.twitter.com/alBOar2I82"
2019-05-01 03:20:50+00:00,"At Tesla, I once found myself pushing back against senior autopilot leadership treating customer privacy as an inconvenience. Most Silicon Valley nerds just don’t want to think about that non-technical stuff. I joined @6d_ai knowing Matt cares and thinks about it a lot.https://twitter.com/TechCrunch/status/1123346535478124544 …"
2019-05-01 03:17:14+00:00,No big deal. Contempt of court. Lol. #tesla $tslahttps://finance.yahoo.com/news/judge-approves-musk-sec-agreement-004758344.html …
2019-05-01 03:12:22+00:00,"BREAKING Fidelity's big funds sell nearly 1 million shares of $TSLA / $TSLAQ, 24% of their entire Tesla position in March! That's 6 million shares, or 66%, in the last year. Blue Chip Growth sold 29% in March alone while OTC completely liquidated. Contra cut 40%. pic.twitter.com/4XblJddQEO"
2019-05-01 02:53:00+00:00,"Ark Invest's Cathie Wood defends her Tesla to $4,000 call - I watched the whole video!!!!! https://www.cnbc.com/video/2019/04/29/ark-invests-cathie-woods-defends-her-tesla-to-4000-call.html …"
2019-05-01 02:45:31+00:00,So epic from @chamath. Absolutely spot on re @elonmusk and @Tesla - the most articulate defense I've heard in a long time. $tslahttps://twitter.com/westcoastbill/status/1123373969187278848 …
2019-05-01 02:06:02+00:00,"Mark Twain inside the lab of Nikola Tesla, 1894. pic.twitter.com/NE8spf7Up9"
2019-05-01 02:01:34+00:00,"In Portugal’s Oil Crisis, Tesla Model 3 Owner Roams Worry Free https://cleantechnica.com/2019/04/30/in-portugal-oil-crisis-tesla-model-3-owner-roams-worry-free/ …pic.twitter.com/SNxsJWRcw2"
2019-05-01 01:55:05+00:00,I had a great time on the podcast today with renegade Tesla rebuilder and start of YouTube channel “Rich Rebuilds” richiebkidd https://www.instagram.com/p/Bw5vgtYlyHB/?utm_source=ig_twitter_share&igshid=x5harddu1vkq …
2019-05-01 01:34:39+00:00,"This is part of the final award of my arbitration, is now public part of my defamation case, for all of those who ever questioned my motives! The reason why I didn’t accept:I wanted a written declaration from Tesla’s legal that Musk listen to my team recordings and our emails!!! pic.twitter.com/C8EsgbZVAn"
2019-05-01 01:33:31+00:00,"NO I dont want anyones projects to go down I carefully distinguish Tesla brand, products, mission—which will survive From current capital structure—which wont It is only management’s choices in integrity/honesty, accounting + operations that has & will cost jobs + stock losses https://twitter.com/DarwynsTheory/status/1123369738313187334 …"
2019-05-01 01:29:16+00:00,"'Wrongful death lawsuit filed in deadly, fiery Tesla crash in Mountain View' https://abc7news.com/5278752/"
2019-05-02 23:54:03+00:00,Tempted to touch @Tesla pic.twitter.com/HV2kxbwuYL
2019-05-02 23:34:07+00:00,Tesla's revenue 2019: $25.5 billion (estimate) 2018: $21.5 billion 2017: $11.8 billion 2016: $7.0 billion 2015: $4.1 billion 2014: $3.2 billion 2013: $2.0 billion 2012: $413 million 2011: $204 million 2010: $117 million 2009: $112 million 2008: $15 million 2007: $73 thousand pic.twitter.com/CYVyDRIFVL
2019-05-02 23:33:48+00:00,U.S. tech companies founded by 1st or 2nd generation immigrants: @Apple @Google @Amazon @Facebook @Oracle @IBM @Uber @Airbnb @Yahoo @Intel @EMC @eBay @SpaceX @VMWare @ATT @Tesla @NVIDIA @Qualcomm @Paypal @ADP @Reddit @SlackHQ @WeWork @Stripe @Intuit @3M @NetApp @Spotify @zoom_us
2019-05-02 23:28:39+00:00,"I hit 50 followers on Twitter! My youngest son wanted to help me celebrate so we took his Model X out for a spin. We hit the road, then did a bit of offroading, and ended up smelling the daisies. ♡ U J @28delayslater @RationalEtienne @elonmusk @Tesla @Teslaratipic.twitter.com/4C8NjxMPxe"
2019-05-02 23:27:45+00:00,Solar Powered S3X! . @tesla @elonmuskpic.twitter.com/6J4BlY5T5Z
2019-05-02 23:27:40+00:00,"The year is 2021 The only company with a fully owned car factory in China is pumping out low cost, high range self driving EVs with 600 mile range they are powered by the only chip designed from the ground up for full self driving Level 5 is old news Tesla is worth $500B"
2019-05-02 23:23:13+00:00,https://www.huffingtonpost.ca/entry/nasa-aluminum-losses-missions_n_5ccae2a0e4b0913d078d918e … This same scammy company supplies TESLA SUSPENSION GIBLETS!
2019-05-02 23:15:33+00:00,Tesla isn't ACTUALLY dead last in autonomous driving. $TSLAQpic.twitter.com/s7HeRiEsTo
2019-05-02 23:15:00+00:00,"Tonight’s business headlines: Stephen Moore out as Trump’s next Fed pick US markets down day after Fed decision Facebook bans controversial figures As cash dwindles, Tesla to raise $2 billion Bombardier to sell Belfast aerospace business https://cnn.it/2E8uQSp pic.twitter.com/nRsoVJ4wZU"
2019-05-02 23:03:12+00:00,"E-tron range is 204 miles for $74,800 ($366/mi) Model Y range is 300 miles for $48,000 ($160/mi) Nearly 50% more range at 2/3 the cost. And Tesla has no battery or tech advantage......? Damn. How do they do it with no advantage?"
2019-05-02 22:51:05+00:00,Good luck to all my friends and followers. The Tesla fraud may never end and I am feeling exhausted. Thanks to many from whom I learned and interacted. Hopefully my cartoons put a smile to your faces. See you all on the other side. $TSLA $TSLAQ
2019-05-02 22:40:39+00:00,"Really hope Tesla Investor Relations releases this call. It is not right everyone can’t listen in. “Musk confidently told investors on the call that autonomous driving will transform Tesla into a company with a $500 billion market cap, these people said.” https://www.cnbc.com/2019/05/02/elon-musk-on-investor-call-autonomy-will-make-tesla-a-500b-company.html …"
2019-05-02 22:38:10+00:00,"GF3 photos taken today, show the mind-blowing “China speed”. Keep in mind GF3 construction was initiated only a a few short months ago and GF1 in Nevada is still unfinished even though construction began in Jan. 2016. Normal auto plants take 2-3 years to finish. Go @Tesla! pic.twitter.com/BSkxHh1igI"
2019-05-02 22:32:45+00:00,"Tesla accuses a news outlet of lying, but refuses to provide any documentation to the contrary. I know who I'm going to believe... https://twitter.com/DanTelvock/status/1124077511879602177 …"
2019-05-02 22:25:37+00:00,"#Tesla refuses to provide supporting documentation on its job tally. We obtained employee list as of Dec '18 b4 layoffs that shows less than 300 employees. And oh, the state comptroller is auditing ESD oversight, and specifically this Riverbend project. https://www.wivb.com/news/local-news/tesla-confident-it-will-meet-job-targets-but-questions-linger/1973770275 …"
2019-05-02 22:21:55+00:00,"Elon Musk to investors: Self-driving will make Tesla a $500B market cap co. And Tesla vehicles will, in about 3 years, be worth $150K to $250K b/c you know, they will be robotaxis that generate income for the owner 100 hours a week. via @cnbctech https://cnb.cx/2GRFeOB"
2019-05-02 22:18:05+00:00,I think we’re gonna need a bigger boat @Tesla @elonmuskpic.twitter.com/5BnVTkq8ky
2019-05-02 21:54:52+00:00,"In pitching Tesla's $2BN bond/stock offering, Musk said Tesla would become a ""half-trillion dollar market cap company"" using autonomous driving - BBG"
2019-05-02 21:36:24+00:00,"Yep. Used to be in sales at Tesla. One time Elon answered a question of mine at a company conference call, that was pretty dope pic.twitter.com/t34aqoAFmn"
2019-05-02 21:33:55+00:00,Tesla Stock Up as Elon Musk Announces Plans to Raise $2 Billion http://entm.ag/id11
2019-05-02 23:46:01+00:00,Tesla’s Giga 3 factory shell takes shape as China works through Labor Day https://www.teslarati.com/tesla-gigafactory-3-shell-roofing-facade-buildout-labor-day-video/ …
2019-05-02 23:45:34+00:00,Exclusive: Tesla expects global shortage of electric vehicle battery minerals - sources http://www.reuters.com/article/us-usa-lithium-electric-tesla-exclusive-idUSKCN1S81QS?utm_campaign=trueAnthem%3A+Trending+Content&utm_content=5ccb811ae506e700010720cf&utm_medium=trueAnthem&utm_source=twitter …pic.twitter.com/mOupacUxlX
2019-05-02 23:44:40+00:00,Nine more superchargers in the books! 138 total unique now. #teslajoyride @Tesla pic.twitter.com/cRwhGETe3z
2019-05-02 23:34:08+00:00,"Elon Musk: Existing Tesla vehicles will appreciate in value to $250,000 within three years due to self-driving capabilities added via software updates. pic.twitter.com/Ocoizvbqiw"
2019-05-02 23:25:01+00:00,$TSLA Here's what I don't understand... Why sweat and groan and heave to raise a couple billion dollars? Elon is a BILLIONAIRE right? Why didn't he just write a check? Anybody? @elonmusk? @CathieDWood? @GerberKawasaki? #Tesla #governmentsponsoredfraud
2019-05-02 23:24:05+00:00,Find Xpos for paid with cryptos #Xpos #PundiXLabs #Xphone #PundiX #NPXS #FX #Cryptos . #XPOS @PundiXLabs_tr @Pundix_br @ArkadiahF @PundixE @elonmusk @Tesla @FUNCTIONX_IO @FintechCH @prodigetv #cryptocurrencyhttps://www.google.com/maps/d/u/0/viewer?mid=1c8SYIM0EGPhrnfovwrT0xenzDdEE2KE3&ll=48.57954168576349%2C7.770180828102639&z=17 …
2019-05-02 23:12:30+00:00,"In a call with brokers ahead of Tesla's $2B raise, Elon Musk said that today's Tesla's will appreciate in value to between $150k and $250k. That would be exceptionally unusual for a mass-market car. https://lnkd.in/es7-sJa"
2019-05-02 23:10:00+00:00,"Tesla heads to Wall Street seeking up to $2.3 billion from share, debt issues https://reut.rs/2JblSGX via @ReutersTV $TSLApic.twitter.com/ahMuPZkwZA"
2019-05-02 23:04:37+00:00,#Tesla expects global shortage of electric vehicle battery minerals - sources (Article via @Reuters): http://bit.ly/Tesla-Expect-Shortage … #OrocobreLimited $ORE $ORL #ToyotaTsusho #Lithium #LithiumHydroxide #BatteryMetals #BatteryTech #EV @benchmarkmin
2019-05-02 23:02:48+00:00,"Instead of book signings, I think I'm going to center marketing around book burnings. If your local Tesla club buys 100 copies, I will show up to the burning in person so you can shriek at me about FUD and Big Oil while cleansing flames consume my subversive & degenerate creation pic.twitter.com/QAEHRg9riU"
2019-05-02 23:01:05+00:00,No need to be in Colorado to support this. It could be used as precedent in any other state! Look out for all EV owners. Please view Sean's link. #family #tesla #evhttps://twitter.com/seanmmitchell/status/1123650348508311552 …
2019-05-02 22:46:03+00:00,Elon Musk described autonomous-driving “transformative” to Tesla in a call aimed at ginning up interest in its debt and stock offering https://bloom.bg/2GPZi3S
2019-05-02 22:44:57+00:00,"By the way, I've never been in a Tesla (in motion) ever....... so if any Tesla owner in the Bay wants to help a girl out, you would make my day, heck, my month."
2019-05-02 22:36:27+00:00,Pro tip. When in a bind (assuming you can safely do so) driving around 30-40 mph will dramatically increase your range and could make your estimated 4 miles range travel 15-20 miles farther.
2019-05-02 22:25:54+00:00,Tesla confident it will meet job targets but questions linger https://www.wivb.com/news/local-news/tesla-confident-it-will-meet-job-targets-but-questions-linger/1973770275 …
2019-05-02 22:18:40+00:00,"#Tesla's full blistering statement will be at the end of the story, publishing soon."
2019-05-02 22:10:51+00:00,"At this rate, GF3 is going to be complete *before GF1*."
2019-05-02 22:07:54+00:00,"Whoa! Wish I could catch this. Anyone out there who can, please give us a report. Sounds like @DanTelvock & @LukeMoretti4, who have done terrific work on $TSLA in the past, hit a big nerve. A ""blistering statement"" from Tesla! Dan, can you give us a link once this is up? https://twitter.com/DanTelvock/status/1124007349251977223 …"
2019-05-02 21:57:58+00:00,"Tonight’s business headlines: Stephen Moore out as Trump’s next Fed pick US markets down day after Fed decision Facebook bans controversial figures As cash dwindles, Tesla to raise $2 billion Bombardier to sell Belfast aerospace business https://cnn.it/2E8uQSp pic.twitter.com/T7r2OOlbHX"
2019-05-02 21:32:13+00:00,*MUSK IS SAID TO SAY AUTONOMY COULD MAKE TESLA A $500B COMPANY
2019-05-02 21:30:00+00:00,Tesla is selling $2 billion of stock and debt—because Elon Musk's big plans aren't cheap http://on.forbes.com/6019Eg5MB pic.twitter.com/GWvtHu0LRM
2019-05-02 21:28:45+00:00,"Years go by, a self-sustaining Tesla eludes Elon Musk.https://www.latimes.com/business/la-fi-hy-tesla-stock-offering-elon-musk-20190502-story.html …pic.twitter.com/MS7zp7gpF6"
2019-05-02 21:27:38+00:00,"1/ After hearing what was said on the investor's call today, it's clear we've reached a point where Tesla isn't only burning the furniture financially, but that they're now doing the same with any shred of reputation they had left. Once the Q2 ER hits, it will be clear that this"
2019-05-02 21:25:09+00:00,"I the EV community. When unplugging my car, another person put himself on waitlist & we chatted. He has a Leaf & canceled Model 3 reservation b/c he believes Tesla will come out with 500-mile battery later. He’s a jewelry shop owner down the street. I’ve made a new friend!"
2019-05-02 21:24:27+00:00,Right! @Tesla https://twitter.com/kimbal/status/1124006531119423491 …
2019-05-02 21:17:58+00:00,Climate economist egged at home . Simon Holmes a Court demonstrates what a disgusting person he is and a danger to our political democracy. He'd never post his own address or the rego of his Tesla. https://www.theaustralian.com.au/nation/politics/climate-economist-brian-fishers-home-egged/news-story/cce9bdbe6fca0fd3061c85b64d26d510 …
2019-05-02 21:13:00+00:00,"""Tesla does not need to ever raise another funding round"" -Schmucksidy Fraud-Boy, February 2012 https://www2.greencarreports.com/news/1073019_tesla-motors-wont-need-more-money-says-ceo-musk … $TSLAQ"
2019-05-02 21:08:24+00:00,Moody's analyst Bruce Clark weighs in on #Tesla's $2 billion offering pic.twitter.com/2BRGvTwbNP
2019-05-02 21:03:06+00:00,"Sorry for the wait, and yes I drove a Tesla to prom #actup2k19pic.twitter.com/O3A2uHmM1b"
2019-05-02 21:00:21+00:00,"1/ Hey, help me out: Gathering info on what owners love / want on their cars - will organize & get to #Tesla. Comment below w what you love (so they know not to disappear it!) & ideas for future improvement. (Please RT so more owners get their info in.)"
2019-05-02 20:56:51+00:00,"Tesla warns of upcoming shortages of battery minerals, like nickel, copper, & lithium https://electrek.co/2019/05/02/tesla-shortage-battery-minerals-nickle-copper-lithium/ … by @fredericlambertpic.twitter.com/8PxeNGdrIm"
2019-05-02 20:54:56+00:00,Tesla to reduce solar panel prices by up to 16%: NYT http://www.reuters.com/article/us-tesla-solar-idUSKCN1S60JV?utm_campaign=trueAnthem%3A+Trending+Content&utm_content=5ccb56f0e506e70001071e52&utm_medium=trueAnthem&utm_source=twitter …pic.twitter.com/M5zxhhlBTY
2019-05-02 20:51:32+00:00,"Hey @elonmusk, we just found the world's tiniest @Tesla charging station: http://bit.ly/2PF5VtG pic.twitter.com/A0S7YixheG"
2019-05-02 20:51:30+00:00,Prius battery - 80 kg (lithium) or 42 kg (NiMH) Tesla battery ~500 kg (lithium) E-bike battery - 2 kg (if you choose power-assist for your ride). 20x - 250x more battery just to push a big chunk of steel down the road (& back again). No wonder they're running out of resources.
2019-05-02 20:45:34+00:00,"The family of an Apple engineer killed in a crash of his Tesla last year is suing the automaker, saying the Autopilot feature on the car caused his death https://cnn.it/2ZPxxkC"
2019-05-02 20:42:00+00:00,"Family of Apple engineer sues Tesla, saying Autopilot caused his fatal crash http://on.ktla.com/SHGxM"
2019-05-02 20:35:55+00:00,Exclusive: Tesla expects global shortage of electric vehicle battery minerals - sources http://www.reuters.com/article/us-usa-lithium-electric-tesla-exclusive-idUSKCN1S81QS?utm_campaign=trueAnthem%3A+Trending+Content&utm_content=5ccb54a7e506e70001071e47&utm_medium=trueAnthem&utm_source=twitter …pic.twitter.com/IXjAlB88AO
2019-05-02 20:35:50+00:00,It’s another Model 3 street charging day. #Tesla #Model3 #ElectricVehicle @ChargePointnetpic.twitter.com/bzBxKtCmNL
2019-05-02 20:17:08+00:00,SEARCH INTEREST Blue: @MercedesBenz Red: @Tesla pic.twitter.com/MLoJotoHHr
2019-05-02 20:12:01+00:00,"The most bullish signal of all: Elon Musk, Tesla’s CEO, would rather *borrow* $500M against his billions of $in TSLA than just sell $500M in TSLA. What does that mean? This means the one person with the greatest insight into where TSLA is headed believes the stock is going UP."
2019-05-02 20:04:05+00:00,"""CEO Elon Musk told investors to practically forget about the rest of Tesla's business, which he called ""small potatoes"" in comparison."" $TSLA $TSLAQhttps://www.thestreet.com/investing/stocks/tesla-equity-raise-elon-musk-fool-me-again-14947009 …"
2019-05-02 20:00:42+00:00,Consumer Reports survey has ranked #Tesla ‘s in car infotainment system as the best in the auto industry. https://www.teslarati.com/tesla-best-infotainment-system-consumer-reports/ …pic.twitter.com/4OHce9Gsu0
2019-05-02 19:58:11+00:00,"I've been deeply skeptical of Tesla, but this is definitely the single most convincing long argument I've come across. Makes me pause and rethink the skepticism... https://twitter.com/QTRResearch/status/1123678034215743495 …"
2019-05-02 19:32:50+00:00,"$TSLA April US sales of EVs: Tesla Model 3 more than double the sales of all other EVs combined. 10,050 vs 5023."
2019-05-02 19:25:27+00:00,If Musk has truly solved full autonomous driving and ‘Robotaxis’ are inevitable: 1.) Form a new PRIVATE company and raise capital with proof it works 2.) Set up Tesla to mass produce a fleet sale for said new company 3.) Win! If you’re lying...just do what you did today $Tslaq
2019-05-02 19:16:12+00:00,"Tesla owners have the highest average credit rating among car buyers, says study https://www.teslarati.com/tesla-owners-highest-average-credit-rating-study/ …"
2019-05-02 19:10:00+00:00,"Tesla seeks up to $2.3 billion from share, debt issues https://reut.rs/2JblSGX via @ReutersTV $TSLApic.twitter.com/qYsIbn63AJ"
2019-05-02 19:08:03+00:00,"TODAY IS A SMALL STEP FOR TESLA, BUT A GIANT LEAP FOR FRAUD #NOTCOVERING $TSLA $TSLAQ"
2019-05-02 19:07:16+00:00,"Still feeling energized after @axon_us's awesome user conference this week: #AcceleratePolicing ...Check out these photos from an attendee, including the @Tesla Model 3 police car! https://twitter.com/Abramjee/status/1123639167253078016 …"
2019-05-02 19:05:38+00:00,"Anyone else double their Tesla holding when it went to $231? The best way to turn a 'loss' into a 'win' when the stock goes down temporarily is to BUY. $243 is still SUPER cheap, I'm going to keep buying while the stock is still under $250. pic.twitter.com/mubI4KURAs"
2019-05-02 19:03:04+00:00,"It just can’t be overstated that $tsla is simultaneously slashing prices & writing down its own residual value assumptions bigly. Even for Tesla, this is madness. https://twitter.com/TezzlaCFO/status/1124026277361541121 …"
2019-05-02 19:02:23+00:00,Starting hour 2 with the intro track of mix two of #ASOT2019 : @popovmusic & @AbstractVision1 - Tesla #ASOT912https://www.youtube.com/watch?v=DvdG7Hx_im0&t=3728 …
2019-05-02 18:59:40+00:00,"The greatest leaders have skin the game —- @elonmusk is all in! His team @Tesla deserves continued support based on the exceptional Roadster, Model S, X, Model 3 & Powerwall. Let’s complete the mission of ending the ICE engine! https://www.cnbc.com/2019/05/02/elon-musk-may-buy-10-million-of-tesla-stock-in-new-offering.html …"
2019-05-02 18:57:58+00:00,Tesla Semi Spotted Hauling Big Open Load: Video https://insideevs.com/news/347652/tesla-semi-spotted-hauling-big-load-video/amp/ … via @insideevs.com
2019-05-02 18:57:00+00:00,. @GreenMtnPower on Tuesday unveiled a pilot to use @Tesla battery storage systems as meters. https://bit.ly/2GX03Jz
2019-05-02 18:56:58+00:00,"$TSLA raising cash in nick of time, but only enough to cover NT liquidity crunch vs. its really, really big list of obligations. From my report ""Tesla “Autonomy Day” Takes Investors For Another Ride"" (https://bit.ly/2XAEIuU ) out just b/4 disastrous Q119: https://bit.ly/2JcQ1FY pic.twitter.com/ZwZPREKxwY"
2019-05-02 18:54:36+00:00,"Why would someone expect to be able to upgrade range if that wasn't an option? Plus, Canada might feel it was a bit underhanded to decrease range to allow the car to qualify for incentives, and then increase after the fact."
2019-05-02 18:46:32+00:00,"Opinion: The Tesla Equity Raise: Fool Me Again, Elon! https://buff.ly/2Y4o7Qx"
2019-05-02 18:31:10+00:00,Sooner rather than later you will respect @Tesla and the vision of @elonmuskhttps://insideevs.com/news/347601/video-dodge-hellcat-race-tesla-model-3/ …
2019-05-02 18:01:18+00:00,Millennials are pouring into Tesla's stock following the electric-car maker's disastrous quarter http://bit.ly/2UZdnkl
2019-05-02 17:55:25+00:00,Tesla's Quest for Better Batteries. How Tesla will integrate Maxwell tech with ultra capacitors to reach new heights in range and performance. Great watch https://youtu.be/DE_PZQ13YTY
2019-05-02 17:47:33+00:00,Tesla is not allowing range upgrade on new 150 km Model 3 in Canada - DO NOT BUY https://electrek.co/2019/05/02/tesla-model-3-range-upgrade-canada/ … by @fredericlambertpic.twitter.com/CYTmilG9Gh
2019-05-02 17:47:27+00:00,"Have received a portion of the Tesla bank call recording. Don't have time to work through till tonight, but here's a fun snippet on @elonmusk bullshitting on where he'll make the Model Y. $TSLA / $TSLAQ If you have recording feel free to DM me. pic.twitter.com/elcREKHbiz"
2019-05-02 17:47:06+00:00,"April @BMW down 2% @MercedesBenz down 11% @Tesla UP 98% Hey, @CNBC, report this pic.twitter.com/anOyfa0Pgg"
2019-05-02 17:46:49+00:00,"Tonight at 6pm, @LukeMoretti4 and take a look at Tesla, its job numbers and the challenge it has in the coming year, how the state made concessions for the company a few years ago and more. And we will include at the bottom the blistering statement we got from Tesla last night."
